,reviewId,userName,userImage,content,score,thumbsUpCount,reviewCreatedVersion,,replyContent,repliedAt,appVersion,at,,,,,,
1177,0f886961-09aa-4253-9d87-8ed6e108e0f4,Iwan Iwan,https://play-lh.googleusercontent.com/a/ACg8ocIexnYW7qtog2NdcTki7_YypqWbDVhcxuqYw9OhaCmJyhmhPg=mo,Aplikasi sangat bagus dan mudah di mengerti,4,0,2.23.0,,,,2.23.0,12/17/2023,,,,,,
1178,57e02fcd-2b6c-496a-a796-8e94e5e17c07,zaki sadewa,https://play-lh.googleusercontent.com/a/ACg8ocIk-gcCJCjnk_M4A3ezaqKyv6ZR3uq-ugwU1FpeQKJG6nv3zA=mo,Apk nya bagus tapi kok nggak bisa tred sekarang ya knp Karana update kah mind,4,0,2.37.0,,,,2.37.0,6/11/2023,,,,,,
1179,56890fdb-7be4-49bc-afa3-f059f8f69449,Nanda Zalfa,https://play-lh.googleusercontent.com/a-/ALV-UjUGM4dY1YKmuNzxm7Z6jc5nLIx7xylKAe4r-IS82ahBoO93e7h7,bagus nih aplikasinya cocok banget buat pemula kaya aku,4,0,2.4.1,,,,2.4.1,10/23/2022,,,,,,
1180,83c6d868-52a5-4835-acb6-9d4c12e0bd79,Nizam Maulana,https://play-lh.googleusercontent.com/a-/ALV-UjXFPlP6Ah0sS386HEQ2QyC2FQpotXrMN9K1JVbLhC91EVIXSTY,Sangat bagus untuk penghasilan tambahan.OK lah,4,0,2.30.0,,,,2.30.0,8/8/2023,,,,,,
1181,343ddcca-c4b2-43bc-9847-7c34e86cabec,Ellin taufik,https://play-lh.googleusercontent.com/a/ACg8ocLjiHGQa0vJk3XH6uNNvGc2SckMXJXmhGf0fLyROughWiEvJQ=mo,Pemula dan belum berani nilai lebih soalnya belum bisa mengunakan,4,0,2.28.0,,,,2.28.0,6/26/2023,,,,,,
1182,dfced94a-6142-418b-85da-5ff3e7978dfb,abdul kadir,https://play-lh.googleusercontent.com/a-/ALV-UjVv6IXccL8NST0ClwUI28cLiRIzqs_uXVzLq1mPt2wS6J8Sn_ya,semuanya bagus..cuma wd nya aja yang kurang cepet..mohon perbaiki wd nya agar lebih cepat🙏,4,0,2.27.0,,,,2.27.0,4/6/2023,,,,,,
1183,02d579e2-2b17-4043-9cdd-2c4a1f149e4e,Dimas Agung adha (Gem),https://play-lh.googleusercontent.com/a-/ALV-UjVLChTeGXmK_DwDjb2bw27EWFdj3eXR5cjnh-I5VA-fRUMkmd-t,Chart analisis nya masih suka ngebug,4,0,2.26.0,,,,2.26.0,5/30/2023,,,,,,
1184,484be7dd-2b38-442b-b42d-75ca094af868,Andi Hendrajaya,https://play-lh.googleusercontent.com/a/ACg8ocJ1un_nOPU39mr1bqcbL6EA-X0gtl19-mY7DkUF9d9DtLzBnw=mo,Beda dengan aplikasi yang lama apa? Terus kripto yang di aplikasi lama gimana? Thx,4,0,1.0.1,,,,1.0.1,8/22/2022,,,,,,
1185,315e9453-d46a-4206-a588-4f7f69c79061,JAYA Doge69,https://play-lh.googleusercontent.com/a-/ALV-UjUnF8pd0Xtu-it6T14_7C2UQmSXSMrvoS9v0loAd9GwBbXAN1w,Sangat bagus dan cepat GK berat,4,0,2.29.1,,,,2.29.1,7/14/2023,,,,,,
1186,1db8a482-46cc-4c18-a58f-6cc7e5dd32f2,Marshall sugiarto,https://play-lh.googleusercontent.com/a-/ALV-UjVzOv5HbioNLFpilOL8CBrmYbxTTZ3MniiL745Iorow_90Vbte7,"Simple,g ribet pstnya menguntungkan",4,0,2.15.1,,,,2.15.1,1/24/2023,,,,,,
1187,5cccaaa8-6454-4aa1-9988-9e2b937ea155,tata wira,https://play-lh.googleusercontent.com/a-/ALV-UjWZ-INM0tDNrFx6IJIqPMqOTOGhC0Cf670YhNU8BijsOe-3835n,"4 aja dulu, besok jadi 5 klo udh bisa auto order 🙏",4,1,2.0.0,,,,2.0.0,8/9/2022,,,,,,
1188,d502d99e-c13f-48f5-8403-c8ebc79dadf0,sevold flame,https://play-lh.googleusercontent.com/a-/ALV-UjVP91NpZISRLPiBks19kMBowp1J0n85h8nCUBxheA0z6O-OcBA,"Enak si aplikasinya cuma koinnya sedikit banget, harapan q si koin kriptonyadi banyakin + diadain fitur untuk membuat garis"" pada candle stick kayak di ajaib saham kan udah ada tu",4,0,2.8.0,,,,2.8.0,11/16/2022,,,,,,
1189,97e96576-9f76-421f-a9a9-ea81dedfe49f,ilham ramdani,https://play-lh.googleusercontent.com/a/ACg8ocJ0tvNVtTT1lZJLsuQ67cd8Q5z9q3KSjHsWEJ11O2DhVTwK8g=mo,"Aplikasinya udah oke, saya harap akropolis masuk listing di ajaib kripto karna potensial..",4,0,,,,,,8/9/2023,,,,,,
1190,4505b6ef-b0bc-4c35-838f-847ba8ad2b37,Yuzar Anafi,https://play-lh.googleusercontent.com/a-/ALV-UjX99LwamtcX7Vro-Qk37Nx4fjF5BEsIxERYLv8iKTXXCb0w60Sd,Aplikasinya bagus dan mudah di pahami,4,0,,,,,,8/23/2022,,,,,,
1191,fcd3d7bc-5719-4612-8284-5f0d364583f8,Dhita Christanti,https://play-lh.googleusercontent.com/a/ACg8ocIKXWAYpY0x943LyANVEN4Bg-7o0ZhV8tsSVHqVeOr0Gd9gLQ=mo,Bagus banget aplikasinya cocok buat belajar nihh,4,0,2.4.1,,,,2.4.1,10/23/2022,,,,,,
1192,7af39cd1-a46f-4c09-80a6-5da99948ddd3,Sementara New,https://play-lh.googleusercontent.com/a/ACg8ocLa1_NsnGad-BnTD6G4q5jzyEg9O0BOjmKV41vdg2iBXhrpMw=mo,Aplikasi investasi yang sangat bagus untuk pemula 👍,4,0,2.5.0,,,,2.5.0,10/27/2022,,,,,,
1193,735ad03b-40ea-4878-be60-de46a123f672,Riez,https://play-lh.googleusercontent.com/a-/ALV-UjVnGypOaenjo_x4PuWXouMbLPlNiPpwNKFRI33Hh8MGWrp7wKdt,Di tambah keterangan harga rata-rata d portofolio dong min biar ga hitung manual saat melakukan beberapa kali pembelian.,4,0,2.23.0,,,,2.23.0,9/5/2023,,,,,,
1194,45485dc8-6e2d-432e-8337-8776b66d4a4c,Rosse Eilish,https://play-lh.googleusercontent.com/a-/ALV-UjW-BPqhIuGCSli6WTTHGYTS8h5aBoskvP663_c4Hifc7hePzLE,"Aplikasi investasi yang mudah digunakan untuk pemula kaya saya, simpan dana investasi aman, verifikasi cepat dan mudah gak bertele tele, tampilan apps menarik dan mudah dipahami, serta sudah terpercaya, semoga semakin ditingkatkan lagi kualitas nya",5,7,2.46.5,,,,2.46.5,4/29/2024,,,,,,
1195,c4d1f228-30cc-45cc-8cd9-d511a1a88a55,Elyn Astuti,https://play-lh.googleusercontent.com/a-/ALV-UjXSPXSLW-fSsQvXN2UNXGVdx_IcjJsYW9-k5XhywuaYFeQ6IKk,Aplikasi yang sangat membantu buat berinvestasi untuk yang pemula yang mulai mengenal investasi. Semuanya jadi gampang karena sudah ada langkah-langkah nya jadi tidak ribet. Cocok banget yang mulai belajar investasi. Aman dan mudah,5,8,2.46.5,,,,2.46.5,4/29/2024,,,,,,
1196,91339c85-27a0-4251-b7f3-741160888a35,Okta Via,https://play-lh.googleusercontent.com/a/ACg8ocI8BRUmNloOrqOLF0eGlY4deO53YMsA7VIAoTLYN7lGja0FBQ=mo,"Fitur aplikasinya mudah digunakan tidak ada ngebugg2, dan transaksi juga lancar, aman, dan sangat terpercaya. Udah 2 bulan pakai aplikasi ini alhamdulillah selalu lancar.",5,1,2.46.5,,,,2.46.5,4/29/2024,,,,,,
1197,210511d8-ce67-4021-9289-328ad166bb98,Ayumi Dara,https://play-lh.googleusercontent.com/a-/ALV-UjVYrwsVqXKHkyZfi4SwKeCK7cHbE1ukqQfCMgwaXFT0EXLMTvE,"Nemu aplikasi kripto keren sih menurut gue, karena buat pemula seperti saya ini memudahkan dalam berinvestasi, di sini aman dan amanah, banyak promo menarik juga, fitur fiturnya pun mudah di mengerti bagi pemula. Rekomendasi banget nih aplikasi terpercaya",5,1,2.46.5,,,,2.46.5,4/29/2024,,,,,,
1198,58a1ab4b-c707-4b47-8564-766b09ced859,beny utomo,https://play-lh.googleusercontent.com/a-/ALV-UjWcnrKUa9frACHTiTR72zFNzmampPv35CkwN32lZB2hPlt28IA,"Aplikasi bagus untuk investasi, ringan, cocok untuk pemula seperti saya, menu2 nya lengkap dan sangat mudah di gunakan...yang pasti nya aman",5,0,2.46.5,,,,2.46.5,4/29/2024,,,,,,
1199,9a681c82-d169-489c-ab7a-da33e7a0aed9,Nanik Widyaa,https://play-lh.googleusercontent.com/a-/ALV-UjVPn6Q3ZFD763qTsstuAuEOhk1y2xCE28zOn4cn612rSqBAnry-,"Ajaib kripto salah satu aplikasi crypto yang aman transaksi juga lancar cocok buat pemula seperti saya, aplikasinya juga mudah digunakan.",5,1,2.46.5,,,,2.46.5,4/29/2024,,,,,,
1200,10e54397-1e9c-41cf-bd13-be6d43af7145,Gaspar Roby,https://play-lh.googleusercontent.com/a/ACg8ocLA3Eef30658x689CNezgD77tARr2GYHgojLCXXUvEW8cPv=mo,"Keren sih ini aplikasi cocok buat pemula kayak saya,bisa investasi aman disini dan terpercaya tidak scam, ambil cuannya pakai kode saya ( putrkpgj ) supaya dapat hadiah dari ajaib,beneran bagus aplikasinya kalian juga bisa trading dengan aman di aplikasi ini, dengan fitur yg cepat dimengerti oleh pemula, mantabb aplikasinya,",5,26,2.46.5,,,,2.46.5,4/20/2024,,,,,,
1201,5444365b-65f3-4129-bc4b-a27bde786d36,Nafisa Nindita,https://play-lh.googleusercontent.com/a/ACg8ocIvyH4e7eHQ8-mse7pIlOWzklqeGjT9TbKJnk6terbC_ZmFJw=mo,Aplikasinya lengkap dan gampang banget dipakainya apalagi buat pemula seperti saya. Overall saya suka. Thebest deh recommend pokoknya!!!,5,1,2.46.5,,,,2.46.5,4/29/2024,,,,,,
1202,3eeadaed-fa4d-4e03-9bcd-e5c3e64b4949,monika tri wahyuni,https://play-lh.googleusercontent.com/a-/ALV-UjW-zAkJ0g5A7SpTAA0fKnWDtb3SajaOn8JA-ekZLnoshfsPNw,ajaib kripto aplikasi trading yang cocok untuk pemula tampilannya juga bagus dan fitur-fiturnya mudah dimengerti,5,1,2.46.5,,,,2.46.5,4/29/2024,,,,,,
1203,202af847-178c-48cc-8a50-575ff59de097,Dea Andriani,https://play-lh.googleusercontent.com/a-/ALV-UjWhSrLIMnKep_qI--TJKSZlaCABtVRRWClDmbYGWPBPTkSFD1EB,"Ajaib kripto aplikasi trading yang cocok untuk pemula seperti saya, karena fitur2nya lengkap, dan juga ada promo2 menarik...pokoknya ajaib kripto top.",5,16,2.46.0,,,,2.46.0,5/4/2024,,,,,,
1204,9720dac2-1b89-430d-8530-af92d322a48d,malik gibrantara,https://play-lh.googleusercontent.com/a/ACg8ocJAuaqIU7mMB94-4TFZKEijypEncH0IV7FLjJ3ZhVoNc3WAhQ=mo,"aplikasinya enak banget dipake buat yang mau memulai berinvestasi dan aman banget, smoga kedepannya semakin mudah dipakai",5,0,2.46.5,,,,2.46.5,4/29/2024,,,,,,
1205,5f79d5dd-9c81-4a77-ace7-11e4fa9cbfa3,Ihsan Ihsan,https://play-lh.googleusercontent.com/a/ACg8ocK3zOTvNVTw6isdAfw-Qyan0E48MTgW4LJgt2AYW1v5892Mfw=mo,"Suka banget sama aplikasi crypto ini, recommended banget buat yg mau nyobain tapi masih takut², soalnya mudah dipahami cuy bagi pemula",5,0,2.46.5,,,,2.46.5,4/29/2024,,,,,,
1206,379f3f22-4703-49d7-b716-35b4ccb620b5,Wati Widya,https://play-lh.googleusercontent.com/a/ACg8ocITlF8rukSfkYN9Y_kDlgRtIcJ8H1IKwnRlU502wBvcyGqvLg=mo,"Salah satu aplikasi trading andalanku nihh tidak pernah ngebugg, selalu lancar transaksinya. Mantapp maju terus ajaib kripto.",5,0,2.46.5,,,,2.46.5,4/29/2024,,,,,,
1207,e856d564-9d2b-4d7e-8daf-dd2a75391071,JOEL KARJAN,https://play-lh.googleusercontent.com/a-/ALV-UjVB9Yy3PekWBWDqQ53XGl624nlTH3PE815daLnmAcgRLx10NcKIhA,"Biaya penarikan mahal, potongan juga mahal, blm lagi harga pas kalah... Aplikasi ini tetap menang.. harga masih bisa up",5,0,2.46.5,,,,2.46.5,4/30/2024,,,,,,
1208,0a1277b3-0ad6-4cf1-9e3e-24f6b44de89f,Eri Monica,https://play-lh.googleusercontent.com/a-/ALV-UjUKpL-11lrhs0cRNb1koxqHIrigmZgJXqaAw6Mygn-dHHIsZg,"Aplikasi ajaib kripto ini cocok bgt buat pemula ky ak yg baru mau belajar, fitur nya keren dan mudah dipahami jg",5,0,2.46.5,,,,2.46.5,4/29/2024,,,,,,
1209,d4deead5-14de-466d-b48f-6a32684858d8,Pamela Alodia Herbyanto,https://play-lh.googleusercontent.com/a-/ALV-UjWm9JAsOfBMAkZAP9S84-bYVGb6VSPYEWP53_JZ5r0ct3k3QC4r,Bagi yg baru belajar soal crypto aplikasi ini sangat cocok. Karena fitur2 di dalamnya mudah dimengerti oleh para pengguna pemulaa serta cocok untuk investor berpengalaman👏🏼,5,5,2.46.0,,,,2.46.0,5/4/2024,,,,,,
1210,2a6e469a-4fdd-4602-a5ed-1cebab9a5d98,Zalza Mega,https://play-lh.googleusercontent.com/a-/ALV-UjVMyXJb-4GNLDpPvPnibqt0GIcJjIHUyKFHyYKA0d_A8f92dmfh,"Keren banget aplikasinya, segala fiturnya keren dan ga bikin bingung gampang banget di gunain juga. Love it",5,0,2.46.5,,,,2.46.5,4/29/2024,,,,,,
1211,6873e4ee-bdee-4be8-96a8-b711d0c476a4,Lia,https://play-lh.googleusercontent.com/a-/ALV-UjW907OSEcgAk9WzaTh37urWXxJ8prJ9gOI75j9i6PVsqLznDppG,"Cukup mudah dipahami, fiturnya juga lengkap dan proses transaksi cepat. Bisa tau loss atau profit nya secara langsung dari fiturnya buat para pemula",5,13,2.45.1,,,,2.45.1,5/4/2024,,,,,,
1212,bdb88763-cf2d-499a-8175-2fc628ba6254,Yoosavier,https://play-lh.googleusercontent.com/a/ACg8ocK2_wM1PKCFBaLhrdu66FbRVDHBK1MSkIoQKFBaF0483YnMUw=mo,"Fiturnya cukup mudah dipahami buat gue pemula yg baru ngerti kripto, so far gaada eror atau apapun sih mantep bgt aplikasinya",5,0,2.46.5,,,,2.46.5,4/29/2024,,,,,,
1213,4301332f-7a84-4b2b-9cb4-c08eb3c5b995,Galang gasper,https://play-lh.googleusercontent.com/a/ACg8ocLh3i_6AvHA0U3uAPJ1od9AmkoAsXrhk4WfNdlvbmo9em9nkg=mo,"aplikasinya sangat menarik sekali,dari segi desain ,fitur , UI, dan UX mudah di pahami , terima kasih",5,0,2.46.5,,,,2.46.5,4/29/2024,,,,,,
1214,1b8d13f3-69d8-470e-90d0-fed7394426e6,ROHID,https://play-lh.googleusercontent.com/a/ACg8ocKS8-U08WX0Btv5NRNtU6CC3lGvlyy8kBPyJTWgz8qJXQmgsA=mo,Mari belajar bersama sama aplikasi ini transaksinya cepat banget depo nya cepat sekali dan tidak bikin ribet,5,0,2.46.5,,,,2.46.5,4/26/2024,,,,,,
1215,27587714-c839-4fff-930f-1a39b1bad61d,Aurelia Rebecca,https://play-lh.googleusercontent.com/a/ACg8ocJuQdk_MuI8tmA-bOxmUftpJP50DeNMaMtUQbPwLy6lAylSmQ=mo,"Aku sih suka karena ada limit ordernya dan bisa topup dari RDN Ajaib. Sejauh ini sih belum ada kendala ya dan semoga ga ada hehe. Cocok untuk pemula apalagi tuk yang sudah mahir, pokoknya cuan dari apk ini",5,13,2.45.1,,,,2.45.1,5/4/2024,,,,,,
1216,48e848ae-6b96-4953-8572-615c8ac2d577,inact ayis,https://play-lh.googleusercontent.com/a/ACg8ocITKfStfnmZ4aSmmn2o2Rddmz0UuQ9XcGLmDKbeqeWmX628Zw=mo,Fitur2nya mudah dipahami dan lengkap. Sangat cocok untuk yg baru mulai belajar,5,0,2.46.5,,,,2.46.5,4/30/2024,,,,,,
1217,e9ab27cd-197a-4516-b9a9-5f8075cfeae3,Edy Bayu,https://play-lh.googleusercontent.com/a-/ALV-UjW73m-KlC3LxgldIYb1ClL1EEk4UgT72jLqVSfzL3jNlyfvMbHo,"Aplikastinyavsudah bagus, tapi maaih banyak koin koin yang belum ada di sini, sama tolong donk kak, tambahkan ewallet untuk penarikannya, tidak semua punya rekening, kan bisa pakai ewallet, massa top up nya bisa ewallet, penarikannya gak ada kak, mohon ditambahkan kak",5,60,2.42.0,,,,2.42.0,2/14/2024,,,,,,
1218,96afc71d-c2c6-4d37-a4e0-84ba80765176,Nanda Aprilianti,https://play-lh.googleusercontent.com/a/ACg8ocKNdapL5ej0thE6clljVnD7qXUCifjozQtEaF7D1dCJRxR8Hw=mo,"Aplikasi sangat mudah di gunakan untuk pemula, bisa top up dengan rekening dan e-walet apa saja jadi sangat praktis. Prosesnya juga cepat, buat yang baru gabung bisa masukan kode ajaib nandhbyc untuk dapat hadiah aset crypto gratis. Dan untuk admint crypto request tambahin koin ondo min",5,11,2.42.0,,,,2.42.0,2/27/2024,,,,,,
1219,16781ebc-3055-4703-8a25-ef5e8acfb6a6,Baby Raizela,https://play-lh.googleusercontent.com/a/ACg8ocKUQXSs7WhIWp1eacNR7Ik8-4UykoZCNf4ybpNkxTB9yM7ZCw=mo,"Guys Abis nyobain Aplikasi Kripto Ajaib, aku langsung kepo terus soal kripto. Bener-bener bikin ketagihan! Gak nyesel dah gunain aplikasi kripto ajaib 🥳 cocok bagi pemula kayak aku 😍 ga ribet 🙏",5,3,2.44.0,,,,2.44.0,3/23/2024,,,,,,
1220,1bc6c5d6-c5ab-4246-8c6c-f265a27d2ddd,ipin sopandi,https://play-lh.googleusercontent.com/a-/ALV-UjWJgwRa388-V1Ovq1vc-0a8p8JgBHLXrHLzO348NHpDf4myMgJR,"Saya suka karena ada limit ordernya dan bisa topup dari RDN Ajaib. Baru satu minggu mencoba dan sejauh ini belum ada kendala. Cocok untuk pemula apalagi tuk yang sudah mahir, Pokoknya okey tiap hari bisa cuan",5,6,2.44.0,,,,2.44.0,12/3/2024,,,,,,
1221,f2e1f606-f63b-4d6d-97d4-cb4adeab02a9,Mutia Winda Alzahra,https://play-lh.googleusercontent.com/a-/ALV-UjXUV_tvHcWiMzRDEGZtbWGI2Hq8FrCok4Vgm6ls-4aNcUq3TVeG,"Ajaib kripto aplikasi trading terbaik buat pemula bagi saya , banyak promo menarik nya juga , terbaik deh aplikasi ajaib kripto top banget",5,0,2.46.5,,,,2.46.5,4/29/2024,,,,,,
1222,da7d71ae-76ba-4425-849b-7b8eb5f18417,Azarine nur Salsabila,https://play-lh.googleusercontent.com/a/ACg8ocIenw57w9esuw4gTjXolDPvsvUSEBDAk8CY7Wpw4L69Esb3lQ=mo,"baru pertama kali ini nemu aplikasi untuk transaksi yang bagus banget, aplikasi ini cocok banget di pakai di saya, sangat rekomen! bintang lima dari saya..",5,0,2.46.5,,,,2.46.5,4/30/2024,,,,,,
1223,e10ad960-13cd-47f1-8ead-db4d252e909f,Atina Nurul,https://play-lh.googleusercontent.com/a/ACg8ocIXjSDw5hoHokBMsFL3FQ1lfdtMIRekMQkDjmYHXj4PGdEqmA=mo,"Keren ini aplikasi memudahkan pengguna pemula kaya saya. Aplikasi cryptonya tidak scam, ga lemot, terpercaya pokoknya",5,0,2.46.5,,,,2.46.5,4/29/2024,,,,,,
1224,b8cb553c-44f0-44e4-9d61-daf5cef42926,mia rahmawati,https://play-lh.googleusercontent.com/a-/ALV-UjWTpGaIVESuCNS_FaIwvEn-5E1PjNbPU4kCv1VFEb9BTD7SRBif,"Bagi aku sebagai pemula yang belajar kripto aplikasi ini sangat memuaskan karna fitur"" nya mudah dipahami",5,0,2.46.5,,,,2.46.5,4/29/2024,,,,,,
1225,bf319e66-a1b5-4eee-b2c3-57fccd48c0d2,asan,https://play-lh.googleusercontent.com/a/ACg8ocK7TQUY1fRQpIlC-ZQB5LCnqplUQo8ANmzvqbgevC8HFCjmLbCQ=mo,"Aplikasi ajaib sangat bagus mudah di gunakan, sangat jelas dr harga, brp yg kita beli, untung rugi nya dlm 1 kolom, klo WD langsung masuk dlm hitungan detik",5,0,2.43.0,,,,2.43.0,3/19/2024,,,,,,
1226,365c5437-b71c-4c40-9607-18afabbce940,Stream Offline,https://play-lh.googleusercontent.com/a-/ALV-UjX5xcfGB2vgolvqlWiFz8jqBkQKN2-G875dUfQaXntAsSoteu1P,Saya kasih bintang full. Tolong untuk sinyal nya di sesuaikan dengan aslinya. Walau masih beda bbrapa % dengan aslinya,5,2,2.45.1,,,,2.45.1,3/31/2024,,,,,,
1227,555a2c3a-9a72-41e4-b8eb-3134f44ce4b5,ilham Jumatul Y,https://play-lh.googleusercontent.com/a-/ALV-UjV3TnaHLRaGUUA_MIb5mHE5kvbsb6r_s2a_iNhSN89hpd32wXGG,"salah satu apk trading yg simpel, interface + fitur yg bagus banget buat para pemula",5,0,2.46.5,,,,2.46.5,4/29/2024,,,,,,
1228,d918150d-e5b1-4544-a27a-2625f6c62c08,ebit ridwan,https://play-lh.googleusercontent.com/a-/ALV-UjW5jxzA2wIizr-cV_Enpt41EBsE7YHqRxcG_hboWk5J6qOl3zDL,Kapan ada fitur stop loss. Rugi banget aplikasi bagus tp gak ada pure fitur stop loss. Please ada auto order dong. Biar balik lagi ke ajaib.,5,3,2.44.0,,,,2.44.0,12/3/2024,,,,,,
1229,feb1403f-d049-43fa-b592-959a3a2010f3,skyx razee,https://play-lh.googleusercontent.com/a-/ALV-UjXdeX2aiI5E1bei8q9Cd1iR0BNsEO7_d5SWHSemYPelBSB6LBk,Aplikasinya bagus cepet dan layanannya juga oke banget prosesnya juga cepet kedepannya bisa lebih baik lagii tapi ini udah mantep bgt deh,5,0,2.46.5,,,,2.46.5,4/29/2024,,,,,,
1230,1780d9b1-11df-4af0-b3fd-81380439604a,Alifur,https://play-lh.googleusercontent.com/a-/ALV-UjURVuDt1Sy9BsfWukg-T2bUrrcOiwJeWZApBMuan8IciZxiuODr,"Aplikasi nya bagus dan mudah digunakan, yang kurang cuman koin crypto yg ada di Aplikasi kurang lengkap, mohon tambahkan koin Ondo dan kawan² nya 😄 🙏",5,4,2.42.0,,,,2.42.0,2/25/2024,,,,,,
1231,1d9db51f-381d-433c-9c8c-efdc760af5cb,sopo gemari,https://play-lh.googleusercontent.com/a-/ALV-UjVIJbBgbm1XTpHzgna-L0Kr2B-BWwVyy8DSBya1z8cJ4HPl85W9,Ajaib kripto sangat bagus dan rekomended banget.... Fiturnya sangat bagus dan menarik gampang dimengerti....smkin eksiss ya ajaib sesuai namanya,5,1,2.46.0,,,,2.46.0,7/4/2024,,,,,,
1232,756ca745-23f8-4d3c-96b1-b2e3491266f9,Jabal Arisal,https://play-lh.googleusercontent.com/a-/ALV-UjWjPlbLVuBJSCJ8VRSqfD_lzOZRv_Qn9iPPwTHoAiaeEJD4BS3j,"Aplikasi yang bagus, cocok untuk pemula seperti saya. masukkan kode reff: jabaqqjy Agar bisa mendapatkan bonus hadiah. Tanpa kode reff, maka hadiah tidak akan kita dapatkan. Jangan buang kesempatan yang ada. Terima kasih..",5,1,2.42.0,,,,2.42.0,2/18/2024,,,,,,
1233,4b4478df-3a99-4b63-9622-29f50d1ad6ae,Ari,https://play-lh.googleusercontent.com/a-/ALV-UjXc_nNFufMWhsdaMfdTNaIT9XZsHtm-NNPzjp-nHs6DtRHELlmP,"Aplikasinya bagus. Kalau boleh, dibuat Notif tiap kali ada kenaikan dan penurunan persentasi harga crypto. Bagi Pengguna Baru, jangan Lupa Masukkan Kode Bonus Ajaib nya ya ""arisxtxg"" (tanpa tanda kutip). Pengguna Baru selalu dapat bonus/hadiah kalau pakai Kode ini. Trimakasih😇",5,5,2.42.0,,,,2.42.0,2/13/2024,,,,,,
1234,60b4fce2-3d5a-49c9-8e8f-9043d1f52df6,Moh Ikbal,https://play-lh.googleusercontent.com/a-/ALV-UjVHA6QrJy9SSe0lGnIhLz-aIGUzUKfTE6b3iWpiEHMisznqD8Hl,"Apk bagus, mudah dan praktis. mohon ditambahkan lagi koin² kripto (sats) dan penarikan lewat e wallet nya agar bisa bersaing dgn aplikasi lain. terimakasih ✨",5,5,2.45.1,,,,2.45.1,3/26/2024,,,,,,
1235,943901fb-ff79-4a26-affc-0673f095f630,Roni Silalahi,https://play-lh.googleusercontent.com/a/ACg8ocLI6xDkyscYahyUvIUQyqkXGBWtIJIkpUU8bxnjQ5fWieHOPQ=mo,"Baru Download, transaksi nya cepat , aplikasi lancar ,bagus dan cukup lengkap pokoknya aplikasinya mantap",5,0,2.45.1,,,,2.45.1,5/4/2024,,,,,,
1236,b461e018-2bf1-4bf0-a751-b7cd29a29e20,Melati Senja,https://play-lh.googleusercontent.com/a/ACg8ocJtAwtNZEmVeA_Al2QlFFQGByqbhGq2hNloOjS4VYQRZR2-kw=mo,Aplikasinya bagus dan mudah digunakan fiturnya juga menarik dan gampang dimengerti apalagi buat newbie kaya aku,5,0,2.46.5,,,,2.46.5,4/29/2024,,,,,,
1237,dd588b5f-c05d-4c4e-ba9a-b77190932329,Ferlina Nababan,https://play-lh.googleusercontent.com/a-/ALV-UjW7AOnqcm5_qgM9h0cmSSyr5tqAfufYTaePcsuVTJqV1_KMvyfZ,"Akhirnya ada aplikasi kripto yang gampang banget dipake, jadi semangat mau pelajarin lebih jauh soal dunia kripto.",5,2,2.45.1,,,,2.45.1,3/28/2024,,,,,,
1238,6b13cfa8-2c38-4a72-89aa-e97c9f21e6fe,Fitri Rahmayani (mpitiii),https://play-lh.googleusercontent.com/a-/ALV-UjVwE-eq33deAwMjS2XRnuobdBf5UXMQII_xej60sWUL6eVPDgv7,"Udah lama cari aplikasi kripto yang bener-bener oke, dan akhirnya nemu juga Aplikasi Kripto Ajaib! Cocok banget buat newbie kaya gue, dan juga buat yang udah mahir.",5,7,2.45.1,,,,2.45.1,3/31/2024,,,,,,
1239,3ffca29c-316d-4a5e-b869-36766b1726ad,Aulia Ramdhani,https://play-lh.googleusercontent.com/a/ACg8ocLq4wa0asaruDIiY2ra0aBDzhwnfR-F3Q4wbRm0I3nx4QAZQf4=mo,bisa banget ya aplikasi investasi ini mudah buat pemula cuanna bisa nambah terus sih keren ini app,5,0,2.46.5,,,,2.46.5,4/29/2024,,,,,,
1240,66112110-1b1f-4205-9422-8d2b3bf38760,Adhe Rizkha Putri Febriana,https://play-lh.googleusercontent.com/a-/ALV-UjVzqyToJdQB3EHQEx-y7kkVaPW3pT1ed1KVt3haTb96Pj2qjGCO8Q,"aplikasi yang cocok banget buat yang mau investasi. mudah banget digunain, ngga ribet, aman, dan terpercaya. mantapp 5/5",5,0,2.46.5,,,,2.46.5,4/29/2024,,,,,,
1241,9612dfd7-42b8-415e-a0e7-babcdd5cc454,Anak Gadis,https://play-lh.googleusercontent.com/a/ACg8ocJTMDzUpaMMiLT_QdtBVH46g1rLy8kRYAY_ajTLVUhSrTo-ww=mo,"apk nya baguss banget, layanan nya mudah dan tools nya efisen, memudahkan pengguna bangett",5,0,2.46.5,,,,2.46.5,4/29/2024,,,,,,
1242,5b99cdaf-0c8d-4888-941b-ed5c95ca505d,Leon,https://play-lh.googleusercontent.com/a-/ALV-UjXAPoJbzSiRfhHw_cmov6G1rxxhT2ufuw4XfogOO27iVNuTWpnc,Semuanya sudah bagus!! Cuman saya hanya ingin mengajukan Tampilkan PNL harian & bulanan🥰 Aku pikir itu penting untung melihat portofolio yang bagus.,5,0,2.45.1,,,,2.45.1,3/26/2024,,,,,,
1243,3d657db0-af90-4783-81e7-e9bf2d7e3bd5,Liliana Putri,https://play-lh.googleusercontent.com/a/ACg8ocJAtbQVpf_5-bA7jcGRfC8emBj8a6hU13dg0IAlbuceupa97Q=mo,Sangat rekomended untum membeli crypto sangat terpercaya dan ama. Aku juga jadi pake apk ini terus,5,0,2.46.5,,,,2.46.5,4/29/2024,,,,,,
1244,d847aaa2-22eb-4100-a6fe-9a2ae0f34aef,Paryono 123,https://play-lh.googleusercontent.com/a/ACg8ocI2Tge012aHsfFHW63dyU-m_558tL0hHBE-TnVfSFDlOLQRNA=mo,"Sangat bagus dan fiturnya juga mudah dipakai, cocok untuk pemula",5,0,2.46.5,,,,2.46.5,4/29/2024,,,,,,
1245,62258e41-2999-486a-9c62-0d5c78502c5d,Alif Prtama,https://play-lh.googleusercontent.com/a/ACg8ocLrdYXTT9nDSpp4iTK-MGafwTpKhEkkWcI4PjDcQhuJFZ9e3w=mo,"Aplikasi helpfull bgt, navigasi mudah trs update terus jd gak lag. Thankss",5,0,2.46.5,,,,2.46.5,4/29/2024,,,,,,
1246,66739a3b-129f-4035-8e3b-e429b04cd574,Arrr Nittt,https://play-lh.googleusercontent.com/a/ACg8ocJqpeIAjb9VoqtHZ0mF7b8mAhJn-zwTPTuxT_8hly9PAEdxzw=mo,Bagus bgt aplikasi ny gampang d pake transaksi beli crypto disini jg aman lancar ga lemot tampilan ny menarik rekomen bgt deh,5,0,2.46.5,,,,2.46.5,4/29/2024,,,,,,
1247,f7cb89fe-85f1-489b-80a8-40952d853066,y suf,https://play-lh.googleusercontent.com/a-/ALV-UjUEZ7IXktbdbKfc5ZcFOXHmnGNMjhb4Kx81_QuXdXHgXlcKQD7RFQ,"Dari skian exchange mungkin ini yg menyajikan aset IDR jd mudah dipahami , saran aja tambahkan penarikan menggunakan wallet lain gak harus bank , biar mudah dlm hal transaksi",5,2,2.43.0,,,,2.43.0,2/27/2024,,,,,,
1248,5eef686a-5fda-4345-ab36-7d2e7caa133e,Dimas Ramaja,https://play-lh.googleusercontent.com/a/ACg8ocIP5EMRtZqiso_qwMfNlSnQrrYqtwXCcJaxk79p3AcwlZPMtg=mo,"Kenapa saya sudah verif pake ktp dan selfie proses identifikasinya belum selesai udah 2 hari ini, tolong di respon secepatnya ☺,thx for the response.",5,2,2.42.0,,,,2.42.0,3/3/2024,,,,,,
1249,a84adec6-1dcd-48b8-935b-12e7776b7024,naomi tiffany,https://play-lh.googleusercontent.com/a-/ALV-UjUaulU2Fb44CixZL1ZPzyGhLwjdCXfngrqqVTvw77eK0HjR9E_u,kaliann bener bener bisa belajar crypto pamek aplikasi ajaibb ini.. fiturnya gampang banget dipahami.. ini rekomen banget buat temen temen yang mau mulai investasi,5,0,2.46.0,,,,2.46.0,5/4/2024,,,,,,
1250,d01a04b5-d773-4d40-a505-78438a4c60ca,Elliel Daily,https://play-lh.googleusercontent.com/a-/ALV-UjU7EsbLzFPYJJ9hs1jKCATw-sR1ZPtczd4wxIph-LEOV2dNdJI,"Chart setiap aset tidak muncul, dan beranda ngebug sehingga semua aset pergerakan harganya hanya terhenti disitu",5,1,2.45.1,,,,2.45.1,3/31/2024,,,,,,
1251,bfa4a6fa-9fe7-4d93-ba69-8649fc6f794f,resti yanti,https://play-lh.googleusercontent.com/a-/ALV-UjXluORXHZpNwZtI0rU3pFsnFXJlRUU-cAjLybTFQd9FKzrCxDfqfg,Wahh aplikasi ajaib kripto bagus banget buat aku yang pemula bisa investasi aman dan nyaman,5,0,2.46.5,,,,2.46.5,4/29/2024,,,,,,
1252,508ef142-51f6-4ff0-8b7d-2cd700a6226c,Ai Sopiah,https://play-lh.googleusercontent.com/a/ACg8ocK5mTPuBX90qwL4KhNLz0XUUwyiiZ81mt33bhfpUG--J_BrJw=mo,Aplikasi nya keren cocok untuk pemula yang ingin jual beli kripto dengan mudah dan tanpa ribet,5,0,2.46.5,,,,2.46.5,4/29/2024,,,,,,
1253,b1875cf3-e78b-45ec-b587-d645041b67d6,Nita Valentina,https://play-lh.googleusercontent.com/a-/ALV-UjX9mYMD8mL0CKVbDqBaWeSnbfHmIFLTAxCbErUDDLF3JT3k9YZR,"Aplikasinya mudah dipahami untuk pengguna baru, fiturnya juga gampang digunakan.",5,0,2.46.5,,,,2.46.5,4/29/2024,,,,,,
1254,08695e8d-300b-431f-9216-5d552f240f4a,Wulanfby,https://play-lh.googleusercontent.com/a/ACg8ocKSGNIw6CAUqSEZqkDr7p0oGvz63Mahte5BJVYX0izt936x1w=mo,"Bagus bgt, aplikasinya mudah dipahami fiturnya juga gampang digunakan",5,0,2.46.5,,,,2.46.5,4/29/2024,,,,,,
1255,1ed14ef7-d29e-41be-93ea-72bd9604dd9e,nurul amiroh,https://play-lh.googleusercontent.com/a-/ALV-UjWcycsTVmZuTsRtkU437qr3-scF7LlS5GziqBfrNj6Fk-8Iqkej,"Ini menarik , layanannya bagus Baru instal apknya , so far masih aman Semoga aman terus yaaa",5,0,2.46.5,,,,2.46.5,4/29/2024,,,,,,
1256,de8bd963-c643-46c4-a060-e7dba8c53f7f,Ratam,https://play-lh.googleusercontent.com/a-/ALV-UjU0VBLItAi0hRvSax3sLqUqaP3EddSc6G6RzXEOL4O0EBrxbw5pfQ,"Aplikasinya bagus,mudah dipahami fiturnya lengkap cocok muat pemula kaya aku",5,0,2.46.5,,,,2.46.5,4/29/2024,,,,,,
1257,5139044a-b3ad-4a3f-9620-ab5eed207197,Jamal Mal,https://play-lh.googleusercontent.com/a/ACg8ocJeUsMY5eKM_IN6f5GMzRrNGqF2vMpVXT_RS9vd5_eyszxJ5g=mo,Ajaib emang keren . Cocok banget untuk pemula . Gak ribet dan super simple .,5,0,2.46.5,,,,2.46.5,4/29/2024,,,,,,
