,reviewId,userName,userImage,content,score,thumbsUpCount,reviewCreatedVersion,,replyContent,repliedAt,appVersion,at,,,,,,
1892,76e8d856-5ea0-4c56-ae39-142d2e5bf97b,akas,https://play-lh.googleusercontent.com/a/ACg8ocImdSL_fgGDnzJ44K7PKoQ9-ORM_129LmInnAHCfJlHEE2XyA=mo,"aplikasi yang bener bener ngebantu buat pemula, gampang paham juga gampang untuk dimengerti. beneran aplikasi yang bagus banget, ga nyesel download deh.",5,0,2.22.0,,,,2.22.0,4/20/2023,,,,,,
1893,3c65610a-4ff6-4ca1-bbd2-6e0ca580184e,Keyla Ditra,https://play-lh.googleusercontent.com/a-/ALV-UjUvNytjH2qryQsI17hLFoAeb4uStTHiHrFcomxpx-1XhSiCzdY,"aplikasi ini sangat membantu bagi pemula yang ingin belajar kripto, dengan fiturnya juga yang mudah dipahamii kerenn ajaib kripto",5,0,2.20.1,,,,2.20.1,1/4/2023,,,,,,
1894,8a16f697-ab3a-4e41-964a-b03dd0a22a47,Fitri,https://play-lh.googleusercontent.com/a/ACg8ocLNnQ75C4JAz7lt8TwTMa-V-vNV22j_IDCD09zfnP6-rEl1gBw=mo,"Aplikasi ini sangat bagus untuk pemula fitur fitur nya juga mudah dipahami,, suka sama aplikasi nya..",5,0,2.20.1,,,,2.20.1,1/4/2023,,,,,,
1895,9b9b207b-0fbc-4979-b735-1d0440c8ac59,Dina Maulin,https://play-lh.googleusercontent.com/a/ACg8ocIlK9x3Hjv6mP-536sFNbQfJjVGhkH6bOBQmsY6QnL-8V1PkA=mo,"Aplikasi yg cukup bagus buat pemula kaya saya ini buat belajar invest crypto, tampilannya juga ngga bikin bingung.. apalagi ya pokoknya keren lah..",5,0,2.20.1,,,,2.20.1,3/29/2023,,,,,,
1896,31fcf6e4-7b8d-443d-b9d7-33633b843c1b,aszphfi shinigami,https://play-lh.googleusercontent.com/a-/ALV-UjX_OTu5FSfEgizja42eVRnAZUzcTdMJpuzS-1DOi55TJkCFrLIh,"Alhamdulillah selalu lancar dan mudah di gunakan.. Tolong untuk ke depannya tambahkan mainnet lainnya yang bisa deposit dan tarik melalui alamat dompet seperti tron, cosmos, avalanche, polkadot dll, jangan lama2 update nya .. Supaya lebih efisien dalam transaksi... Terimakasih 🙏",5,0,2.15.0,,,,2.15.0,1/16/2023,,,,,,
1897,a476643c-5cdb-41eb-93ed-3bde4616aafe,R&R CHANNEL,https://play-lh.googleusercontent.com/a-/ALV-UjV1Q2-dYNmzCuwAyRZ8epz80L7LtSvFdsbvARJJ3dQARRwC7ppu,jangan lupa pakai Kode Ajaib ( ariedbgy ) agar saling menguntungkan.,5,0,2.44.0,,,,2.44.0,3/17/2024,,,,,,
1898,57f3509f-a5bd-4335-a870-ab807045c5ae,Yanti Yuli,https://play-lh.googleusercontent.com/a/ACg8ocLY1yxZVjUDqWrLdPPFhFw7fH_o5WJpmtYms04My8u6mzCL=mo,Aplikasi bagus banget bagi pemula nih!! Tampilan mudah dimengerti aplikasi aman untuk berinvestasi bagi pemula registrasi anti ribet,5,0,2.23.0,,,,2.23.0,4/30/2023,,,,,,
1899,c4e1eb77-f9ae-42ff-a7d5-9434a25fc1b3,Anis Khoirun Nisa,https://play-lh.googleusercontent.com/a-/ALV-UjVQIE7FoD_wglPEF-68MKCohQLtISsSCvIkns6Q786Oy2KWI4boSQ,"Keren banget, aplikasi investasi yang mudah digunakan buat pemula yang mau belajar kripto, fitur-fitur nya juga gampang digunakan, pencairan nya juga bisa lewat e-wallet ataupun transfer bank",5,0,2.23.0,,,,2.23.0,4/20/2023,,,,,,
1900,bd67c5fa-b06a-4836-905c-33cc87ffb4d7,dufu.,https://play-lh.googleusercontent.com/a-/ALV-UjVSE1LXTAN_2Kyzx0YbPUwK5WPGBGqxW68716SOAld0t_TV5CYf,"Aplikasi recommended buat pemula kl mau investasi! Tampilannya oke gak bikin bingung, registrasi gak ribet, dan aman bgt buat dipake investasi",5,0,2.23.0,,,,2.23.0,4/29/2023,,,,,,
1901,bb71adee-4dc7-40e7-9f8c-a9d871418582,C l a r i s,https://play-lh.googleusercontent.com/a-/ALV-UjVCXZ6O7FYRlljtgpwzpsZvq4WrsWREa8a7RWL5uZo3RMbRi0Fp,"Aplikasinya bgus, sangat mudah untuk digunakan. Tampilanny juga menarik, dan mudah dipahami bagi pemula.",5,0,,,,,,12/5/2023,,,,,,
1902,e9da7ae6-9063-405f-a1fe-bed51055414f,Rizky Al-Fath,https://play-lh.googleusercontent.com/a-/ALV-UjVrNcJAJxMWoMVfaWYUq0W9Jr-AJ9pvSzdl1IFy9YnaN636fvWx,Semoga bisa menjadi aplikasi trading yang bermanfaat bagi semua orang,5,0,2.44.0,,,,2.44.0,3/18/2024,,,,,,
1903,08733d11-c671-4357-a2c6-e78241168a7c,Nur Elisa,https://play-lh.googleusercontent.com/a-/ALV-UjUIZJprUm5k_N8RPwfv3ipxfLNKS-mY8xlSxDXoCgyqsx9mn385,"Suka banget sama aplikasi ini, bener-bener ngabantu buat pemula kayak aku yang mau belajar tentang kripto, tampilannya juga bagus dan sangat dipahami.",5,0,,,,,,8/4/2023,,,,,,
1904,5ef0ca5c-64de-41d2-8a11-3d4d60a228a6,r.anabels,https://play-lh.googleusercontent.com/a-/ALV-UjXwT2HhKgY16Ks5AK_9MxkOgYl3yUbC55jODRK8LnsDeLyJcu0,"Aplikasi investasi terbaik! mudah di mengerti fitr fitur nya apa lagi untuk pemula sangat cocok, aplikasi ini juga mudah di gunakan",5,0,2.22.0,,,,2.22.0,4/19/2023,,,,,,
1905,1b5caa7e-e9ea-4818-a02a-9895009abb84,Indrawesti ratna,https://play-lh.googleusercontent.com/a/ACg8ocLjCgg5hjPk7lLEBWv2cTkbCMaxYmncgJkinkkW5Tqf6tBDAn4=mo,"Aplikasi ini sangat membantu bagi pemula, fiturnya juga mudah di pahami, nyaman diakses. Aman dan terpercaya",5,0,2.21.0,,,,2.21.0,8/4/2023,,,,,,
1906,e3a51559-cf79-4988-9272-6f69086bd08c,Wina Maulani Putri Winardi,https://play-lh.googleusercontent.com/a-/ALV-UjVVtsixiLv1rw587-HM6mOipOfjquQPhJfQnRK-mjY_895OWmV9,"Aplikasinya bagus untuk pemula yang baru belajar tentang kripto, fitur fiturnya lengkap juga tidak rumit untuk dipaham",5,0,2.20.1,,,,2.20.1,8/4/2023,,,,,,
1907,fa3cfec3-caed-4391-a015-82fb0a4702e0,silvi ariyanti,https://play-lh.googleusercontent.com/a-/ALV-UjWcBpUG50Mwma5kqL_xOn_pwWfGXajULKyoWUrxafTjGb2uuvZgDw,"Bagus banget, saya baru mulai trading langsung paham pakai ajaib kripto, semoga hasil nya memuaskan ya. Bantu saya trading lebih baik lagi ya ajaib kripto! Sukses selalu.",5,0,2.20.1,,,,2.20.1,3/30/2023,,,,,,
1908,6747e93c-8d32-4fc1-b664-6a6ec6422dc3,Anggi Yunella,https://play-lh.googleusercontent.com/a-/ALV-UjWNkkh9qdij0ZuZOAOiS3mJFuIQamZCVocWsQzzvJ3BafjQIXHr,"mantep banget deh ajaib kripto, selain berizin dan diawasi oleh Bappebti, aset dan transaksi juga terjamin keamanannya terus memiliki layanan customer service 24 jam buat membimbing perjalanan investasi aset kripto, jadi ga perlu khawatir ygy.",5,0,2.20.1,,,,2.20.1,3/28/2023,,,,,,
1909,2afadb73-7a65-46b0-a557-284a270db03f,anggia,https://play-lh.googleusercontent.com/a-/ALV-UjX1JS5aUSFfmijPNvkkK-EoYVLXynR6_FB8lex0_godj7GtkXqb3w,aplikasinya membantu banget bari kami pemula apalagi fitur fiturnya yang sangat sederhana dan mudah dipahamii,5,1,2.21.0,,,,2.21.0,4/17/2023,,,,,,
1910,2bb051e1-6000-4d3b-8b82-d9db57b82cfe,Nca Uyey,https://play-lh.googleusercontent.com/a-/ALV-UjVK6ev9sYfE6f3hIDZvzPc7AvTo3Ak7VFlmGjztP5fKkQR0Sy0F,"Loginya mudah kalau sama aplikasi ajaib,menunya mudah di pahami dan sangat membantu",5,0,2.21.0,,,,2.21.0,3/4/2023,,,,,,
1911,6993da58-4b13-4a28-8666-3ecfccd44306,ahmad_sopandii,https://play-lh.googleusercontent.com/a-/ALV-UjUD6OZEq7_N9xWzdXrQqF0blV8nSoYhuGn66MZmU8-KFEr5K-bl,"Sekarang kalo mau investasi ngga pakai ribet dong karena aku sekarang pakai Ajaib Kripto, semua aset kripto lengkap disini, paling aman, terpercaya dan pastinya mudah dan cepat.",5,0,2.20.1,,,,2.20.1,3/29/2023,,,,,,
1912,e4629714-71ae-49e5-8ce3-4a05f509e894,annisa amanda,https://play-lh.googleusercontent.com/a/ACg8ocIaUXUIfXUIRRNNUMgd0CBNgBj3hyy1-RmeyjIMDaElwuxBZg=mo,"Aplikasi nya sangat bagus untuk pemula yang mau belajar tentang dunia trading ,dan juga sangat aman untuk berinvestasi, fiturnya juga mudah dipahami",5,0,2.23.0,,,,2.23.0,2/5/2023,,,,,,
1913,4110cff3-fc89-46cc-80cd-598ff4f52c42,Man 3,https://play-lh.googleusercontent.com/a/ACg8ocKGBLRxKwnl2u9S4HDwECqKUZeqevZpSTPJAzETUPc5xpz3xg=mo,"Mantap banget nih jadi lebih mudah lagi buat transaksi kripto, fiturnya juga nenarik² Ama banyak mata uang kriptonya, banyak bonus nya lagi",5,0,2.23.0,,,,2.23.0,4/27/2023,,,,,,
1914,ba4c1f5f-d39c-4238-94de-e76ff6e14e9f,ahmad tanjung,https://play-lh.googleusercontent.com/a-/ALV-UjXp8J-HwquK2CmqB58lkj4gmKkwLjWXkotUsB0eCOgPlKQ_EM_a,"cocok buat jual beli crypto, fitur nya simpel mudah di pahami cocok lah buat pemula seperti saya, keren ajaib kripto.",5,0,2.23.0,,,,2.23.0,10/5/2023,,,,,,
1915,eb00b98f-bbce-4915-8b83-77701ddf76da,Lala,https://play-lh.googleusercontent.com/a-/ALV-UjUMzgBx6h1kW-EHA39ycmvKTt_1sJaIlyIJc2Dg0R6IGsI6Cvo,"Aplikasi dapat dijalankan tanpa hambatan, tampilan bagus dan simpel, mudah dimengerti untuk pengguna baru👍",5,0,2.20.1,,,,2.20.1,1/4/2023,,,,,,
1916,94f7212b-587c-401a-b8ea-e9c6c93c695e,Pia,https://play-lh.googleusercontent.com/a-/ALV-UjWxd8yn_LNiwZ-b-O7pjkHIu-F6Vny9XsY6A5Ov6u91c6CxwUey,"Aplikasinya cocok banget buat pemula kayak aku, fitur-fiturnya juga gampang dipahamin dan ga ribet buat mulai belajar investasi",5,0,2.23.0,,,,2.23.0,2/5/2023,,,,,,
1917,de8263c6-2af6-4db4-b3c6-e8ac1e9b547e,Zaina Project,https://play-lh.googleusercontent.com/a-/ALV-UjX6w8Ubii4m5d5Jnvkn6zqXzqxxUojaPfvreoX0odrY_Gikd5n1,Keren aplikasinya dan gak makan tempat. Aset kripto ku bertambah banyak .padahal sekali topup. Mudah transaksi nya,5,0,,,,,,9/22/2023,,,,,,
1918,5d59f74d-28b9-4308-b838-29d891d7443d,ratma wati,https://play-lh.googleusercontent.com/a-/ALV-UjV_qChYmB_OnxuBObHPit2msmwxgehAE25-Wk-B3vqdCPniiLKq,"Aplikasinya bagus buat para pemula yang mau beljar tentang kripto, fiturnya mudah dipahami buat para orang tua ataupun para remaja",5,0,2.21.0,,,,2.21.0,7/4/2023,,,,,,
1919,6f6b01e5-7b8c-4dea-96b0-ba0a8ddfde3e,Aan Novel,https://play-lh.googleusercontent.com/a/ACg8ocIKinmG_YkwVAzjRCz2N7NVn9bPoMvy7UyHKSQutgxtOjaovQ=mo,"Aplikasinya mudah sekali di gunakan untuk saya, fiturnya mudah sekali untuk di pahami buat yang baru belajar. recommended banget dah👍",5,0,2.20.1,,,,2.20.1,1/4/2023,,,,,,
1920,e670a9b2-77f0-410a-9e2b-4d8b520e2dca,Niken Tibi,https://play-lh.googleusercontent.com/a/ACg8ocIL5fAxdWBY2lZq9A-Tjw2qx2I79YGHJFBxts5R9y5_HID6lg=mo,"Ini aplikasinya bagus banget recommended buat pemula yang baru mau berinvestasi kripto, banyak fiturnya tentunya ga ribet dan mudah dipahami",5,0,2.20.1,,,,2.20.1,3/29/2023,,,,,,
1921,9f29067c-d52e-4d9a-9e1a-fc6ee8704638,Shafhah Nabilah,https://play-lh.googleusercontent.com/a/ACg8ocKktJBvMikbJUtvL1Qvnhv46OqPZyK3qI27HX5JZ5FiRPnjuA=mo,"Bagus aplikasi nya,buat pemula gampang ,mudah buat di mengerti buat kripto ,sangat rekomendasi untuk aplikasi nya ,buat transaksi nya bagus ,",5,0,2.21.0,,,,2.21.0,10/4/2023,,,,,,
1922,bd38f441-ea19-4c1c-a47c-c4854cbac3a8,Tarzan Ndeso,https://play-lh.googleusercontent.com/a-/ALV-UjXpWKHotdrFRkDnS4M3e--A4BkwD5lIEKL5h-TOYA7dyLG1FvVO,"belum bisa veryfikasi harus ganti hp biar foto lebih jelas,dan yg ini kayak belum support semua diredmi not3 atau mungkin aplikasinya yg belum joz ,3 hp satu akun GK bisa selesaikan masalah",5,0,2.15.1,,,,2.15.1,1/31/2023,,,,,,
1923,28317755-a0d8-49ee-b36c-849106350c49,Deo Pratama,https://play-lh.googleusercontent.com/a/ACg8ocKzS4ywfytsWaHd1gKatXvWfhVh_hZA95g_HEEIFufFlI5VfA=mo,"Aplikasi yang sangat simple yang pernah aku coba, fitur sngat mudah di pahami untuk yang pemula keren ajaib kripto",5,0,2.16.1,,,,2.16.1,2/20/2023,,,,,,
1924,5888b7d1-02d2-42ba-ad17-b8439a389896,Siti Nur Shofia,https://play-lh.googleusercontent.com/a/ACg8ocJ4LAYO80DP2N8-0kYDG81G98BMxyAICGldvh4lNi7LfyF7mQ=mo,Aplikasi nya sangat mudah digunakan untuk para pemula apalagi dengan fitur fitur nya yang sangat mudah untuk di fahami.,5,0,2.23.0,,,,2.23.0,4/20/2023,,,,,,
1925,a1239205-e49f-4243-bf6c-b4f1f3a3cfde,wendi wiguna,https://play-lh.googleusercontent.com/a/ACg8ocJAytJv3nwOxQl18-xa3p7eWBwxpeqS_ZkfR5hdtAozP7TFlQ=mo,"Aplikasi kripto yang menarik,simple dan mudah untuk di pahami.Proses deposit dan withdrawnya cepat,recommend banget buat jual beli aset kripto di sini.",5,0,2.36.5,,,,2.36.5,10/30/2023,,,,,,
1926,5b8e8cba-7139-40ac-a9f5-9148768985aa,ZKYRIO,https://play-lh.googleusercontent.com/a/ACg8ocLWAZ6X3Iqo-IsmoFamxg25pRB7Ww7FdPqRs8F0aFNRbq9Enw=mo,Dari segi tampilan aplikasi ajaib ini ssngatt friendly user dan sangatt memudahkan bagi pemula seperti saya. Recommended sekali,5,0,2.20.1,,,,2.20.1,3/28/2023,,,,,,
1927,eeab9419-740e-4aaa-a5e2-1ff6e6f395b9,Idha Nuryati,https://play-lh.googleusercontent.com/a/ACg8ocJrmleWUVmyKu_Do9sJ2nvGVTOgCBDJnNyLDgMXCl-jPhoFEw=mo,"aplikasinya bagus, cocok buat pemula yang ingin investasi. fitur fiturnya gampang dipahami. good",5,0,2.23.0,,,,2.23.0,4/27/2023,,,,,,
1928,1ce1292c-d264-4ebe-9593-89d26a055339,Rizka Amalia,https://play-lh.googleusercontent.com/a/ACg8ocI2ArB0F3ElaosN55eD7Ua_nUnmXqzhz5N2p7wX32WAEu_mXA=mo,"Ajaib Kripto sangat nyaman digunakan untuk pemula yang ingin belajar investasi, karena bisa dimulai dengan jumlah yang tidak terlalu besar.",5,0,,,,,,2/4/2023,,,,,,
1929,28938aab-dcf7-4293-94cd-7d43ee311dde,Redmi 8a,https://play-lh.googleusercontent.com/a/ACg8ocLuS2IIgAiG43plPxftdhyGB0SLVWJ8fN97ALzQ_SQn_RbZ=mo,Aplikasi nya bagus untuk pemula yg baru mencoba investasi fitur nya juga mudah di mengerti dan sangat membantu.,5,0,2.20.1,,,,2.20.1,3/28/2023,,,,,,
1930,1079a14b-1233-4e48-b05b-92cf29196344,Cahyo Dwi santoso,https://play-lh.googleusercontent.com/a/ACg8ocIr2UBWoBIuB0-3QCCM7jLf3ksvnl4vQyA_QHFtMaI92XMmMQ=mo,Salut sama apk ini. Membantu saya untuk berinvestasi melalui ponsel saya tanpa ribet dan makan waktu lama. Sat set pokoknya keren,5,0,,,,,,2/12/2023,,,,,,
1931,ac3cc979-736d-42dd-9c83-d5ca8e59619a,geruuyy,https://play-lh.googleusercontent.com/a-/ALV-UjVK79ORk7sDr1zS8NRQozLTmewQWz9PcbC1LA-vf5vED8xtLcs,aplikasinya membantu banget apalagi masih pemula dan binggung rekomend banget untuk pemula seperti saya juga,5,0,,,,,,4/29/2024,,,,,,
1932,dfd82e6a-f48d-4f27-9720-b8694371c697,Senja Bianca,https://play-lh.googleusercontent.com/a-/ALV-UjUGLkPKTI0PRtLYCzdALKW0vslV4o6zCeUUDumFhwSqohd9bwU,Aplikasi ini bagus banget buat pemula yang pengen investasi daftarnya mudah dan caranya gampang dan pokok suka deh sama aplikasi invest ini,5,0,2.36.5,,,,2.36.5,10/30/2023,,,,,,
1933,74f5af31-974c-481a-a7dd-69c3f7e1abf5,Denisa Nur,https://play-lh.googleusercontent.com/a-/ALV-UjUbR_VZMtjbrugpvYMF46_-3CTmnzQdzke024DNcWFwXJ-cOPW7,Aplikasinya menarik dan cocokk bgt buat pemula yg mau belajar trading. Fitut fitur nya juga gampang di mengerti,5,0,2.23.0,,,,2.23.0,3/5/2023,,,,,,
1934,267e58aa-1c42-40eb-a708-cf910c518d9b,Nur halifah Anastasya,https://play-lh.googleusercontent.com/a/ACg8ocIwcFgGoTm6O7Ei3lKQnfWxARKHvGJPZ388Djaeo4v9wIXB1g=mo,"Aplikasi nya bagus untuk pemula yg mau investasi crypto , fitur² yg mudah di pahami dan sangat membantu mudah di gunakan thebest lh pokoknya",5,0,,,,,,1/4/2023,,,,,,
1935,9c88b244-5bf5-4844-ae1f-1a7198d6320f,Zipan,https://play-lh.googleusercontent.com/a-/ALV-UjXpEW4o0jSp5dbqRty0FklU-KmeVLwcE9P2eT5Q_IUFe500tD4,Saya suka dengan aplikasi ini karena sangat membantu pemula yang ingin belajar kripto selain itu aplikasinya mudah dipahami dan nyaman diakses.,5,0,2.20.1,,,,2.20.1,3/4/2023,,,,,,
1936,2f20f94a-c310-497d-b6fd-826f8278f885,Iwan Setiawan,https://play-lh.googleusercontent.com/a/ACg8ocK6XJrRD3IITgldIF5vTJ6199N42eNLQprOM1b1ZjYRgtRKoQ=mo,"Apknya cocok banget buat pemula yang mau coba berinvestasi, fiturnya juga lengkap dan mudah digunakan..",5,0,2.23.0,,,,2.23.0,5/5/2023,,,,,,
1937,a89298cb-b84b-4ec4-9e33-0bc3fbc3ec34,Andi Ermawati,https://play-lh.googleusercontent.com/a/ACg8ocKK72WP0O76efv7wuIyrFPcaOtN962fp_hLKwGEV5M1myYOVQ=mo,"Aplikasinya membantu banget buat pemula yang ingin belajar trading, proses verifikasinya juga cepet, sudah dapat izin dan diawasi oleh bappebti jadi aman untuk investasi, fiturnya keren dan mudah dipahami.",5,0,2.23.0,,,,2.23.0,1/5/2023,,,,,,
1938,2a67b1e5-db6e-44a7-a298-42b692371a0c,Puspitasari,https://play-lh.googleusercontent.com/a/ACg8ocJs5XUsHvsKHhNk6Euz2kv85TzcO22JaPteFrKxG-0DYPBs7g=mo,"Aku sebagai pemula bener bener terbantu banget sm aplikasi ajaib kripto, jadi gampang ngerti banget, recommend banget buat pemula",5,1,2.34.0,,,,2.34.0,9/24/2023,,,,,,
1939,c8f7282a-fc91-4c8f-a960-bc97597e547d,vinalia wijayanti,https://play-lh.googleusercontent.com/a-/ALV-UjVXVejdfZx6QZ8ESZyVSytk_E7332sQjbjELDOmK4BvNcldzEbZ,"Aplikasinya sangat membatu saya yang masih pemula untuk belajar kripto, fiturnya mudah digunakan, dan aplikasi ini sangat terpercaya",5,0,2.20.1,,,,2.20.1,1/4/2023,,,,,,
1940,a77517b2-72c6-4b32-bbd9-54a3a90869a8,kinci kecil,https://play-lh.googleusercontent.com/a-/ALV-UjXr8BfbgD-14IK9M8-pUlJX6XRiHF7nkPY5chHLOlpyowGP2nc,"aplikasinya bener bener bagus banget buat pemula yang mau belajar, bahasanya mudah dipahami, step stepnya pun tertata rapi. keren.",5,0,,,,,,1/5/2023,,,,,,
1941,0e17f8ca-34bf-4e00-b409-9fa8cf36d779,Afahiyah Gwgg,https://play-lh.googleusercontent.com/a/ACg8ocILUFY1vJdok73jzqm_av3ShZrh8p9roiocJZcOgiwB_qwsWg=mo,"aplikasinya bagus banget, mudah digunakan, ngga ribet dan untungnya banyak bangettt.. rekomended bagi pemulaaa",5,0,2.16.1,,,,2.16.1,2/20/2023,,,,,,
1942,345b9627-ef74-4e6a-b3aa-990665a4fa96,Sabila Anasty,https://play-lh.googleusercontent.com/a-/ALV-UjUCxt7Quu9l2FVl7gJJouAMKqN5eF3KCXEjHhD3ZiJhMFrvddH7,"Aplikasi ini sangat baguss, fitur fitur yang mudah dipahami bener bener sangat ajaib seperti namanya, ga bakal nyesel deh install inii. Kerenn",5,0,2.23.0,,,,2.23.0,4/19/2023,,,,,,
1943,61fdc62b-853e-47f8-b831-a0c339dd914a,Ibnu Firli,https://play-lh.googleusercontent.com/a-/ALV-UjUvrDPriHXUnQ1vTlxWNHma3cVljWx5OzEQny4S_SyYo48LEhQ,"Aplikasi yang bagus untuk pemula untuk bermain crypto. Fitur"" yang ditawarkan sangat banyak dan transaksi lebih mudah",5,0,,,,,,3/29/2023,,,,,,
1944,d2f27638-41fb-46f3-8e6b-06a940421cbf,Selena Michel,https://play-lh.googleusercontent.com/a/ACg8ocJsELnEX2U3ZJBMkD7Bm4oU8foSItspDghDjG0KAgJaS4c0ySM=mo,"Dengan adanya aplikasi ajaib kripto ini cocok untuk pemula yang berinvestasi, sejauh ini saya pakai aplikasi ini cukup nyaman dan untuk penarikan pun cukup mudah banyak fitur e wallet lainnya",5,0,2.36.5,,,,2.36.5,10/28/2023,,,,,,
1945,4285511a-b9ab-474c-b02c-dd992fb7fe1d,suya siip,https://play-lh.googleusercontent.com/a-/ALV-UjU0gNecCi3ZtU1KnjQtJdF1I9Ip0Z9dK-meCQLed39LpdhQKKPV,"Aku baru di dunia kripto , biar lebih mudah , Ajaib Kripto tambahin fitur edukasi dong .!",5,0,2.38.0,,,,2.38.0,1/12/2023,,,,,,
1946,36bd32bb-65ef-4a7a-bb09-ca2868bdf374,Dini Yuliani,https://play-lh.googleusercontent.com/a/ACg8ocIx0etCu5WEhEXUaatmINB9XR-jGrjRP9nAculTvpjS0WKE3A=mo,Aplikasi investasi yg mudah digunakan pemula . dan fitur fiturnya mudah dipahami pokoknya recommended bangett dehh,5,0,2.23.0,,,,2.23.0,4/26/2023,,,,,,
1947,92a427fe-ff7f-41f1-a68f-2ff3aa5858f3,Yani Susanti,https://play-lh.googleusercontent.com/a-/ALV-UjW3hG6OwJ9sZLOphx7-MfvaR9yAekmpx9blCOQZAy4OZBhxIr0,"aplikasi yg membantu kita belajar crypto dan cocok untuk pemula, tampilan nya bagus dan mudah dimengerti",5,0,2.15.0,,,,2.15.0,1/17/2023,,,,,,
1948,241e0dbb-cdab-4eff-8ff3-f9ca796600b6,Christian Napitupulu,https://play-lh.googleusercontent.com/a-/ALV-UjUyJI162k7Iptw-FS1I2u0A1rnKSP_IPbiJNBIAYyEyzL5mgWe8,"refund Ondo sudah saya dapat, terimakasih ajaib atas tanggung jawab nya",5,2,2.43.5,,,,2.43.5,5/3/2024,,,,,,
1949,d3c341e1-89e7-4f66-9080-4fa439a69400,mogumoguu 3,https://play-lh.googleusercontent.com/a/ACg8ocJJ6Bbm5yn0r0s-27wnDp-Bf9RhIO3RH-RRjFUxZaQ_JSLwUg=mo,"aplikasinya bagus, sangat membantu, fitur fiturnya juga mudah dipahami, recommended deh!",5,0,2.23.0,,,,2.23.0,4/30/2023,,,,,,
1950,f17588ed-b66c-4d07-9834-a8cdd527d63d,Isabella Khairunnisa,https://play-lh.googleusercontent.com/a/ACg8ocKp3yZLHItaCVjhJUCNg4UaCl1QmL8jiF0cwfy1XqVWvceYhpM=mo,"aplikasi ini sanagat baguss sistem nya mudah dipahami dan fitur fitur nyaa mudahh digunakann, selama penggunaan aplikasi ini saya sangatt merasaa nyamann dengan layanannyaa🤗",5,0,2.21.0,,,,2.21.0,4/4/2023,,,,,,
1951,463acb9e-1b2c-4c27-bb6f-392c88aab06c,Lipi Ayu,https://play-lh.googleusercontent.com/a-/ALV-UjVSL-hCcdoQd_CC4XTzblugDZjjFhL_VrSz_H3sG-5AarlZAPei,"Aplikasinya sangat mudah digunakan fitur""nya juga lengkap...cocok untuk pemula yg mau belajar kripto",5,0,2.20.1,,,,2.20.1,8/4/2023,,,,,,
1952,7ea53d02-09da-48d0-9101-ccd788f77303,Almunawwar Tanjung,https://play-lh.googleusercontent.com/a-/ALV-UjV6VHQkYDUAN326mXoWur0SXOyZ2rAUgPS6W0r3H7OoOL_BNr_Y,"Aplikasi ringan,Price aset real-time, vitur-vitur nya udah oke. Kekurangannya hanya tidak ada vitur price alert",5,0,2.19.0,,,,2.19.0,3/19/2023,,,,,,
1953,21f9836d-302e-48bf-97e6-e693fb5d0c98,Hilda Nurani,https://play-lh.googleusercontent.com/a-/ALV-UjUchvuvzL9ciI1RU0eFFyBHIS7FxJdksB-pp1RgGfoQsmsLsls,"bagus banget apknya, untuk trading crypto aman cocok untuk pemula dan gampang banget soalnya dikasih kemudahan untuk invest.",5,0,2.20.1,,,,2.20.1,1/4/2023,,,,,,
1954,2066c549-c145-4dcd-b36f-9c5807bf72d5,Lubna Nurfh,https://play-lh.googleusercontent.com/a-/ALV-UjU57tr0YkT3HwWxtH6LjPNq7kWpv808ckU_SlYQj7TQjrjwir0,"Aplikasi yang bagus banget buat kalian yang baru banget belajar kripto, sama sekali tidak menyulitkan buat belajar investasi , mudah dipakai dan dipahami",5,0,2.20.1,,,,2.20.1,3/31/2023,,,,,,
1955,38d965c7-495b-4fd2-8a07-80b6e56e2cd3,Reza Baskara,https://play-lh.googleusercontent.com/a/ACg8ocKG2NPe7vwro03e44v2E7cCDDCj_j9FHyjicHku6VtGzMgXcA=mo,"Aplikasi yang paling recommended buat pemula atau yang masih belajar, dari fitur dan tampilannya bagus banget ngga salah pilih deh kalo belajar kripto lewat apk ini",5,0,2.23.0,,,,2.23.0,2/5/2023,,,,,,
1956,914ff558-0f99-4918-979e-dc494cb36e20,Muhammad faisal adik putra,https://play-lh.googleusercontent.com/a-/ALV-UjU-VscaeFGqLupgFqwhEVebOxPg2oemI7PEUoJUz2390oYdy2o,Keren optimal kan lagi aplikasi nya,5,0,2.41.1,,,,2.41.1,5/2/2024,,,,,,
1957,cde44e2b-7da5-4d33-8b17-8fc9ae7e1190,Shiva Sarifah,https://play-lh.googleusercontent.com/a/ACg8ocJfv84ebH_YJgfSE7MDAJ84nvFBnLfxtS_4GLpSYkX8tWyp_A=mo,Pengen belajar kripto & temen recommend aplikasi ini.. awalnya takut susah tapi ternyata gampang bgt dimengerti buat pemula seperti saya.,5,0,2.36.5,,,,2.36.5,10/28/2023,,,,,,
1958,4628c885-7e40-4b8b-bf56-929b2a28d229,Ilyas Aja,https://play-lh.googleusercontent.com/a/ACg8ocKT2pzAquXW7qmb0lVtm1CT9Q37Mf0PvzTEWs3b_sPcl9BhJA=mo,"aplikasi yang bagus untuk pemula, cocok buat investasi,mudah dan simpel,fitunya juga dapat dimengerti. sippp",5,0,2.23.0,,,,2.23.0,4/27/2023,,,,,,
1959,5201a2da-5dfd-41df-8225-054f0622cf2a,Gita Sabila,https://play-lh.googleusercontent.com/a-/ALV-UjVhj4x0tCdqloUnWbDCvAbdovIxAKcNhgiUjWRZvsxwl-jSwaU,"Aplikasi investasi terbaik sejauh ini, fitur fitur nya sangat user friendly dan mudah dipahami, suka banget pokoknya",5,0,2.22.0,,,,2.22.0,4/19/2023,,,,,,
1960,17d84bab-4b25-49af-876f-923b4ddd74da,Anggi Puspita,https://play-lh.googleusercontent.com/a-/ALV-UjVf3hUyvhZ2wrRYBQhUh-olGix_yLHECbhmuGXVtZ5bzITfjU0,"Apk ramah buat yang baru maen.. tampilannya jg bagus, menarik bgt dan semakin tertarik buat belajar. Fitur semuanya lengkap.",5,0,2.20.1,,,,2.20.1,3/30/2023,,,,,,
1961,3a623992-21b7-40cb-8bf3-cd5e98f43b57,Ibu Yatimah,https://play-lh.googleusercontent.com/a-/ALV-UjUOLa_TnyOgUCV1DesSyNtTzQqyfIf2cv2ct4Uzmv62tql1VzMZ,"Aplikasi baguss, fiturnya mudah dipahami buat pemula seperti saya yang pengen simpel dan gak ribet",5,0,2.23.0,,,,2.23.0,7/5/2023,,,,,,
1962,47182b19-e105-4784-a901-7fcbf9e93398,Tukang Maido,https://play-lh.googleusercontent.com/a/ACg8ocKrKfEMjD5uHWQxT7jmHRTkw5m_ag3pedRFAXa8uMzlv5REYQ=mo,"Aplikasi Ajaib kripto sangat berguna dan bermanfaat bagi saya, fitur fiturnya juga banyak dan aplikasi Ajaib kripto nomor 1 dalam belajar didunia kripto",5,0,2.23.0,,,,2.23.0,4/26/2023,,,,,,
1963,7da13586-f168-4ad7-a6b0-be51a26582d9,Utami Utari,https://play-lh.googleusercontent.com/a/ACg8ocL685_QRzqsgiyTsouTtx59CjsmY8S0YiUgtSHniGOngAe8kw=mo,"Aplikasinya menurut ku bagus,mudah di pahami fitur²nya dan juga cocok buat aku yang pemula.",5,0,,,,,,3/4/2023,,,,,,
1964,c1dd10f1-0471-4571-8a10-9d6d3b33cb62,vira salsabila,https://play-lh.googleusercontent.com/a-/ALV-UjXX-UKSg-AVWkqur9bmcSDUpEv2mdjQWdMJxqoqsDUp8zYi7qHk,"aplikasinya bagus banget, mudah digunakan, ngga ribet dan untungnya banyak bangettt.. rekomended bagi pemulaaa",5,0,2.15.0,,,,2.15.0,1/17/2023,,,,,,
1965,86ec8e1f-afb2-42c7-b024-32e245fb08a8,yufrii,https://play-lh.googleusercontent.com/a-/ALV-UjUlwXnuv1OAZu3zoFAH-CO-SJFNxclzjS0dcVJdMnuyLgQtOp8i,"aplikasinya mudah digunakan, tampilannya juga ngga membingungkan. cocok buat investasi pemula",5,0,2.20.1,,,,2.20.1,7/4/2023,,,,,,
1966,414dbf5d-b58c-4976-89b3-d2f14e472452,reza fatahillah,https://play-lh.googleusercontent.com/a-/ALV-UjU_sM2jMJRX1rjZCSF7uSzTKi35d8-kuOp8M5azyRcjuj_e09oB,"Masukannya, di aplikasi ajaib kripto tolong adain berita terkait kripto seperti yg ada di aplikasi ajaib yg biasa, karena sangat membantu untuk menentukan pilihan. Terimakasih",5,3,2.0.1,,,,2.0.1,9/21/2022,,,,,,
1967,74c63498-3457-411e-9150-42a91a7fe5d1,19_Amanda Natasya Tiara,https://play-lh.googleusercontent.com/a-/ALV-UjUUOvu2QBa8Pq2HrY42-AiBxAVy7Y4b918wB6V6VIuc-BsQTmj46g,"buat yang belum tau, kripto merupakan aplikasi investasi yang cocok banget bagi pemula dan didalamnya lengkap banget panduannya. Kripto juga aman banget bagi pemula",5,0,2.23.0,,,,2.23.0,11/5/2023,,,,,,
1968,41db4d24-7d1c-422d-b0ef-39944b86e85d,Nada Fajria,https://play-lh.googleusercontent.com/a-/ALV-UjVFoSaFbOeGNFkF81Lrpoz_k07MVJvAtIN0M6-rfoh3dfAcexM2,"Platfrom inventasi terbaik yang pernah saya coba, mudah banget untuk memulai apalagi untuk yang baru pemula seperti saya, pastinya juga aman",5,0,2.23.0,,,,2.23.0,4/28/2023,,,,,,
1969,043286ce-f6bc-43e0-b5e6-7eaaa33b461c,Amelia Huda Putrianti,https://play-lh.googleusercontent.com/a-/ALV-UjVp-Cid-hp4Sl9K8xnthS12JU-HsL1uMYXSHB_WzF8HgzCdVR4,"Aplikasinya bagus banget buat yg mau investasi.... fitur2nya mudah dipahami pemula, aplikasi cepet jalannya gak lemot, mustii bgt diinstal",5,0,2.23.0,,,,2.23.0,1/5/2023,,,,,,
1970,f7e3e014-a0d2-4d2b-bc20-2d948186794e,Widi Jatnika,https://play-lh.googleusercontent.com/a/ACg8ocLQ03UYN39LqdtYqVC9C8FB9STPPghf1kUb_w56_SOh-u2dqQ=mo,Aplikasi bagus.. simpel mudah digunakan buat Investa,5,0,2.39.5,,,,2.39.5,12/19/2023,,,,,,
1971,c22b8219-fe94-4142-bfbb-73cc58c47ef0,Elice Laurensia,https://play-lh.googleusercontent.com/a-/ALV-UjXKorWtlUITqMX9f_Qwh0vP5rFh-IyoewmiI2ZtpUy5Y398h3Vk,"Fitur fiturnya mudah digunakan, cocok untuk pemula yang baru terjun di dunia crypto, jadi ga bingung",5,0,2.20.1,,,,2.20.1,3/29/2023,,,,,,
