,reviewId,userName,userImage,content,score,thumbsUpCount,reviewCreatedVersion,,replyContent,repliedAt,appVersion,at,,,,,,
0,5f0eaaaa-4772-419c-b0b1-7e655e99e504,Evin Tangdilomba,https://play-lh.googleusercontent.com/a/ACg8ocJT4oSlzHJxUodRCwo6FiIpDa6gwHJfNBDNyzNfr7hxuRzOSA=mo,"Transaksi nya cukup cepat si. Tapi tidak tersedia untuk laptop dan komputer PC jadi untuk lihat grafik nya susah. Login lewat website juga tidak bisa. Jadi saran saya tolong di biarkan aplikasi untuk laptop dan komputer PC nya supaya lebih mempermudah para traider untuk melihat grafik pergerakan harga. Saya koreksi lagi ratingnya saya turunin ke 1 . Soalnya kaspa koin tidak ada, aplikasi lelet slow respon, padahal jaringan bagus, terus keluhan sebelumnya tidak di perbaiki.",1,314,2.43.5,,"Hi Evin Tangdilomba, terima kasih atas saran dan kritik yang diberikan. Kami akan sampaikan ke tim terkait sehingga kedepannya kami dapat menjadi lebih baik lagi. Apabila terdapat hal lain yang dapat kami bantu, mohon untuk tidak ragu menghubungi kami kembali di support.asetkripto@ajaib.co.id ~LS",7/6/2023 8:40,2.43.5,7/3/2024,,,,,,
1,7446777e-48c0-4e20-affb-8a6482b54a6f,christopher immanuelie,https://play-lh.googleusercontent.com/a/ACg8ocLhpNO0izIGbTHr95MIYBqlStbpEFsW6O7T9c0vJKoBHU1d_Q=mo,"Kalu dibandingkan aplikasi crypto lain, aplikasi ini paling terburuk. Transaksi lama sekali loadingnya, nilai pajak yang paling tinggi dibanding aplikasi lain, dan juga tidak dapat dipantau melalui komputer. Sangat tidak direkomendasi memakai aplikasi ini",1,10,2.46.0,,,,2.46.0,12/4/2024,,,,,,
2,39aa3eb3-bcfc-441c-a7ba-09e60d6e062a,Erike Pratama,https://play-lh.googleusercontent.com/a/ACg8ocLA0-_Hi9errimAg54oYmRMdCzUEpfGcPFcgHr56GkuWkAJvw=mo,"Aplikasi sudah di manipulasi agar loss, sekali nya mau jual saat profit sedikit malah gak bisa, harus nunggu sampe loss baru bisa di jual, di pastikan loss.. yg profit yang punya apliksi kayaknya, curang",1,94,2.44.0,,,,2.44.0,3/16/2024,,,,,,
3,09a6a207-5431-4f27-b301-1e9a3fa3a94b,Andre Haryadi,https://play-lh.googleusercontent.com/a-/ALV-UjWYQS8liPmjhFbp99TXArYO-DzZwI3Lx06t1I4YFt_GM7HQrIA,"Jeleknya ini kalo ada pemeliharaan aset cryptonya beku buat perawatan jual beli tidak bisa di lakukan bangke emang saat market crypto aktif 24 jam bisa""nya perawatan aset cyrpto mana lama lagi jangka perawatannya",1,1,2.46.5,,,,2.46.5,4/28/2024,,,,,,
4,c19f599d-ce4f-4145-bb59-8dfd580ac742,Pramodana M. W.,https://play-lh.googleusercontent.com/a-/ALV-UjXFneFjLwafh2a631HiSbRz59dKTERGwMMoiczI26hIArMiakOl,"Pembelian harus ada batas minimal, kirim wallet ada minimalnya juga, narik deposit sebelah juga lama, harga miring jauh dari app lain, bug, tf wallet juga agak lama",1,5,2.46.0,,,,2.46.0,4/18/2024,,,,,,
5,cf2933c2-39d5-440b-befd-c7a3af62b83d,Wayan Yulianto,https://play-lh.googleusercontent.com/a/ACg8ocJ1K2gAZhyVpujvkqP51o3rnokuUDGcKohm0f7qrBr49tml-A=mo,Untuk exchange kripto lokal. Ini yg paling bad respon. Deposit coin dari wallet lain belum masuk dan untuk pengaduan nggak tau kemana. Customer service ngga berguna tidak bisa dihubungi. Sudah lewat email namun tidak ada respon.,1,3,2.44.0,,,,2.44.0,4/18/2024,,,,,,
6,5e88d181-8b76-4141-86b3-426394d6c35d,Ade Sal Buang,https://play-lh.googleusercontent.com/a-/ALV-UjW6yTu3jzAaJntBPRG7g4CxXYc6gIh2rSbdd2fwGeGD6VpjGDTG,"Sejauh ini masih masih baik dan user frendly. Kalau boleh, tambahkan juga fitur web based. Supaya kami yg terbiasa trading dengan laptop, bisa terakomodir",1,6,2.46.0,,,,2.46.0,11/4/2024,,,,,,
7,3e855316-9dd7-4f6f-ad8e-268e729211e2,Dadan Wardani,https://play-lh.googleusercontent.com/a-/ALV-UjViSkVYHmBjlzRIkEplo9axeYa0wnFHIeo3AFyR9VOUAD7nxVoz,"Payah banget nih aplikasi, bisa Nerima kripto dari wallet lain tapi gak bisa ngirim, gak kumplit ada yang ada alamat address nya ada juga yg gak ada ditambah biaya transaksi nya yang mahal banget, banyak bug juga, nyesel banget gua pake nih aplikasi",1,19,2.43.0,,,,2.43.0,4/3/2024,,,,,,
8,7ff5b35e-2795-472a-8efa-9c8efcb47afc,Zidane Alzaidane,https://play-lh.googleusercontent.com/a-/ALV-UjVcIOQjfsUVYm-gI4Jx6lFHdcQW-ZuFR9KLbvoh8X3zsB-97JVK,"Kadang klo kita pakai limit order transaksi untuk status 'matched' lama bgt jadi harus menunggu waktu bahkan sampai terlewatkan timing in the market suatu asset, seperti nya disengaja ya seperti ditahan-tahan, saya masih B1 sudah seharian lebih saya menunggu saya kehilangan kesempatan saya buat trade!",1,58,2.42.0,,,,2.42.0,10/2/2024,,,,,,
9,d2ce6683-773d-4cf3-afc6-296ccf9949be,ChandraFt,https://play-lh.googleusercontent.com/a-/ALV-UjVENoi92xkt1xBJFMEV8SQ9fceOq-9_-Wxba2b8-Ap9-rCLNfBw,"mohon maaf developer, mohon ya, kami para investor juga untuk entry atau exitnya harus cepat, gapakek lama harus nunggu proses withdraw lah, nunggu proses penarikan dan yang sejenisnya. mohon diperbaiki, masalahnya jika sudah waktunya exit dan di ajaib masih ada yg namanya ""proses withdraw"", ya keburu koin yang di targetkan sebelumnya untuk entry keburu ga dapet harga sesuai ditargetkan karena lamanya menunggu proses yang seperti itu, mohon dimengerti, terimakasih.",1,32,2.44.0,,,,2.44.0,3/16/2024,,,,,,
10,efdc3c50-63f6-4ab8-aabb-c0725c8189d9,Yudha N,https://play-lh.googleusercontent.com/a-/ALV-UjWC2i2qQtLpllOibptZndXI0Gd6Erk7-uL28HY8iRatif1iK6Tk,"setiap ada penarikan, tujuan rekeningnya automatis terpilih ke rekomendasi, bukan tetap di tujuan yang kita pilih sebelumnya, sehingga saya tdk tahu dimana saya harus mengakses saldo yang saya tarik!, kembalikan saldo saya.",1,11,2.43.5,,,,2.43.5,5/3/2024,,,,,,
11,2fd6a005-463f-4085-b032-3b997f038346,Hanafi Makbul,https://play-lh.googleusercontent.com/a-/ALV-UjXF4FytgSTGGJ_G852839qtt1xz4qHv8qjfsvKYKOIKDG7ugl4,"Tolong beri tau saya kenapa tidak ada order jual coin saat lagi naik² nya , coin sedang berjalan ? Bknnya 24/7 coin selalu berjalan secara grafik nya tapi kenapa fitur jual jadi tidak berfungsi ? Limit Order dan Market Order gak berfungsi percuma dong gak bisa take profit yang diinginkan user!!",1,17,2.43.5,,,,2.43.5,3/15/2024,,,,,,
12,5b21e8e8-f020-4622-a2a8-b87c8857602f,Ari Irwanto,https://play-lh.googleusercontent.com/a/ACg8ocL6risd2DpFcTgMHHInO85MnOlWj2cf3GtPW4SODZNoKEIx1w=mo,"Saya kecewa dengan ajaib , pada saat awal listing ondo banyak terjadi masalah dan sampe sekarang masalahnya belum terselesaikan , saya hanya bisa menjual dan tidak bisa membeli ondo. Ajaib seperti tidak mau bertanggung jawab dan seperti tidak terjadi apa apa , sangat mengecewakan , bagian informasi juga tidak melakukan apapun , mungkin saran saya untuk teman"" bisa mencari exchange yg lain , terima kasih",1,24,2.45.0,,,,2.45.0,3/21/2024,,,,,,
13,ce2429ad-2ba0-497d-92ca-bb4d7c3366be,Ahmad Mustafid,https://play-lh.googleusercontent.com/a-/ALV-UjWnv32oon485bXqlXSEhv8zEyDFaH0io6vj_6SQuRTf-G7wnXT1cA,"Exchange paling buruk di Indonesia, harga tidak sesuai realtime dengan exchange lain, ada selisih 300-1000 rupiah lebih mahal dengan exchange lain. Lebih baik pindah ke pluang, indodax, dll yang lebih murah",1,23,2.43.5,,,,2.43.5,10/3/2024,,,,,,
14,14caadb0-8dcc-4f93-88ed-b96023c77eb2,Tan Griyo,https://play-lh.googleusercontent.com/a/ACg8ocIe3u1fagEBkuTkysvTonQamZTpCyqfSdawaCEEU-ilhcqfuw=mo,"Untuk ajaib crypto, minta tolong kebijaksanaannya untuk merefund atau reset atas bug aset ondo yang udah terjadi. Error system ada di kalian, sehingga banyak orang yg entry ondo di harga yang tinggi & tidak masuk akal",1,30,2.43.5,,,,2.43.5,1/3/2024,,,,,,
15,ab88397f-21ff-4afe-a482-80216da9b68d,Yuze Chanel,https://play-lh.googleusercontent.com/a/ACg8ocJux8seYtpmzO0AD8UVSvYWHkAm8zqZy4A48gtf5KTlzkpQQ4k=mo,"Gak terlalu rekomendasi pakai aplikasi ini setiap listing koin baru pasti ada manipulasi harga sampai 50% lebih mahal dari harga normal, intinya sebelum beli koin di sini coba bandingkan dulu harga nya sama tempat sebelah jangan kemakan fomo.",1,19,2.43.0,,,,2.43.0,1/3/2024,,,,,,
16,15234633-38d6-4ee0-b3be-2611f1cd8db0,Deni Harapan,https://play-lh.googleusercontent.com/a/ACg8ocKr_AKP5QLKaGHykkfiSU9ojjADvq95LWQb_Ah1aeU-JJr0IQ=mo,"Fitur nya lebih banyak merugikan costumer, sebagai contoh, potongan adm dan pajak adalah 1+1 persen, 2 persen, 2x lipat dari aplikasi sebelah. Wd dikenakan 10 ribu, sementara sebelah cmn 4500. Fitur earn, masuk kedalam fitur 2 hari, jadi kripto kita gak bisa diapa2in selama 2 hari, narik kripto dari earn nya jg 2 hari, jadi total 4 hari. Padahal saat masuk ear saya tidak diberitahu bahwa akan ada penahanan aset. After all saya rugi banyak di aplikasi ini, tq ajaib, sebagai pelajaran, bye2",1,26,2.44.0,,,,2.44.0,10/3/2024,,,,,,
17,dca52cb6-74b8-4a2f-9d36-4b7c445d019c,Dani Plastrana,https://play-lh.googleusercontent.com/a-/ALV-UjUwbADC5K-IJx2c7jxGNYCdqNmMfOBvMOSC421VJf0PGuQmI6A,"Benerin noh apk banyak maintenance nya harga sering nyangkut"" otomatis di kasih harga palsu. Apakah ini apk judi yang bisa di permainkan oleh bandar? Ini kan aplikasi investasi jadi tolong lah benerin maintenance"" nya biar gak ada yang ke gocek permainan",1,13,2.43.5,,,,2.43.5,8/3/2024,,,,,,
18,c0b8b067-6d37-4884-9923-83aa7a39c375,Derasbrita,https://play-lh.googleusercontent.com/a-/ALV-UjVq9561FwFvLujLGK-yt1mjBF6_2n1oztvpqGWm0BLQSFmVQqGT,Saya hanya memberi saran bahwa ajaib kripto sangat tidak rekomendasi untuk orang yang sudah belajar kripto karena banyak sekali hambatan yang saya temui mulai dari harga pasar yang tidak sesuai penarikan susah dan semacamnya,1,10,2.44.0,,,,2.44.0,10/3/2024,,,,,,
19,c2f55adb-7a90-4630-b3d9-fa2244056f90,Deni Setiawan,https://play-lh.googleusercontent.com/a/ACg8ocIFSuLRZu4XxYj2VEfnVVbjjAVP9BarAtYJn5RergSBXCZ2dw=mo,Dalam pembelian atau penjualan tidak sesuai potongan nya .meski sudah d potong pajak tapi setiap kali penjualan suka hilang 20k ke mana padahal pajak udah ke potong.dalam pembelian harga udah sama belum ke beli ke beli bbrapa menit malah harga nya naik malah kga jadi beli.,1,7,2.45.1,,,,2.45.1,3/31/2024,,,,,,
20,d0917a43-056a-4055-a4c0-cf1a31207abe,mikel lanang,https://play-lh.googleusercontent.com/a/ACg8ocKuofBQU8iX0AWamVqlQSjoFh1Gcs2dS3Oy4cJcNtVdXC2rog=mo,Saya menikmati fitur yang ada pada ajaib crypto namun saya sangat kecewa karna tanpa alasan yang jelas orderan beli saya selalu di rejeck yang membuat saya tidak bisa melakukan orderan beli coin saya harap ada tindak lanjut dari pihak AJAIB mengenai hal ini agak yang lain tidak merasa kecewa. Dan 1 yang membuat aplikasi ajaib sangat jelek yaitu aplikasi ini tidak menyediakan live chat untuk melayani keluhan para pengguna yang ingin menannyakan masalah pada aplikasi secara langsung,1,6,2.43.5,,,,2.43.5,7/3/2024,,,,,,
21,d10359c3-19cd-4f5f-a2ba-6f4ebdc7657b,Fais Gg,https://play-lh.googleusercontent.com/a/ACg8ocLnyPAVk9VbSCclHaYpJ3aYTfkgDVnuCyxCCp7Qcwk3o4cFpg=mo,Kak kenapa saat limit order status updating ya? Jadi jaring tidak kena saat order padahal harga sudah masuk. Dana juga nyangkut di limit order tersebut tidak bisa di batalkan atau di ubah.,1,2,2.44.0,,,,2.44.0,3/15/2024,,,,,,
22,82ad9c26-ed37-4634-be1c-802a0eb0c9f1,Adi Saputra,https://play-lh.googleusercontent.com/a-/ALV-UjV2LpdmRwBhZuUNrZfAhcyBdbAqACUrrPjnSJU0YczNvPKCSdU,"Aplikasi nya kurang real time candle sama harga ga sinkron, koin sedikit yang naik itu itu aja mohon di perbaiki lagi jika kriteria di atas sudah di perbaiki saya akan beri 5bintang",1,16,2.42.0,,,,2.42.0,2/17/2024,,,,,,
23,eaf15a30-d91d-4df1-8ec8-bc31b3877749,david david,https://play-lh.googleusercontent.com/a-/ALV-UjXKN5ypyJOAx4y44mJzjWdn0oxQlLh6fzIhbmNoUCiDmIbzLHGn,Kenapa aplikasi Ajaib kripto: eror pas aplikasi kripto di minta foto KTP sudah saya foto ko ga masuk Udah sepuluh kali saya foto tolong aplikasi Ajaib kripto saya pengguna baru ini masak erro aplikasi takut udah invetasi uang nanti malah eror aplikasi nya,1,0,2.46.0,,,,2.46.0,4/18/2024,,,,,,
24,50107721-57df-465b-8f53-9b730ba605b2,Keyto,https://play-lh.googleusercontent.com/a-/ALV-UjXngFmy_e6J2hCOD8GwzayWxYP9MQn-I1Ub9r6cuLoNHEHbwNv9,"Aneh setiap kali saya beli yang awal naik setelah itu ada perbaikan sistem setelah itu tiba"" harga jadi turun tidak masuk akal tak sesuai harga krypto aslinya ini bagaimana,,?",1,16,2.43.0,,,,2.43.0,2/25/2024,,,,,,
25,74c0efeb-7912-47fa-b5aa-7bd904b22cee,HATERS,https://play-lh.googleusercontent.com/a-/ALV-UjVKCxXBy2fRsE-6ZY9toaDyvf7dBo5qOdHET4Y4m2bwYDOExhEH,"Tolong tambahkan fitur penarikan yang bisa dari aplikasi dana,jangan cuma buat deposit aja bisa,mohon di pertimbangkan, terimakasih",1,0,2.46.5,,,,2.46.5,4/29/2024,,,,,,
26,9171c2f7-05aa-4774-839f-e8f2ca2a72b1,Septian Anggi Priyanto,https://play-lh.googleusercontent.com/a-/ALV-UjXTaWFyXCwwJ-FMe0Fg36rSEoaysTvHk-BaefbsTaBa94To1R0n,"Saya transfer ONDO dari exchange lain ke aplikasi Ajaib kripto, sampai sekarang belum menerimanya di wallet ajaib cripto, saya sudah berusaha menghubungi admin dan sama sekali tidak ada bantuan dan kejelasan atas kendala yang saya alami",1,1,2.44.0,,,,2.44.0,3/24/2024,,,,,,
27,a85d650a-42b1-4b10-b6ed-ee59dd205960,Asep Kusoy,https://play-lh.googleusercontent.com/a/ACg8ocKnIwNJmGgpGkQ4H4GfL61fJlio_HkXqxP2mklW178I0Mn-5g=mo,"Ajaib kripto exchange yang aneh, saya tetapkan harga jual sekian di orderbook, malah beda harganya,otomatis target tp gak kesampe, sumpah ini exchange paling aneh.",1,2,2.44.0,,,,2.44.0,3/28/2024,,,,,,
28,09d64aeb-92ed-400b-b153-5b5db84023eb,Adam Hard,https://play-lh.googleusercontent.com/a-/ALV-UjWebF8opG4qJxRigS_DMwlv5-yC7idqYkLsHorAFD5Mog4bBoU,"Jangan Sesekali Coba Pencet Tombol Fitur Earn kawan,aset lu di tahan semua,jadi kalo mau tarik prosesnya lama bgt,gua kesel bgt ga ada pemberitahuan Aset Ditahannya,pokoknya jgn dipencet dah earn nya,takutnya bearish gabisa buru²dijual",1,3,2.44.0,,,,2.44.0,3/15/2024,,,,,,
29,8c1dd399-4d87-4402-b040-3ba9fdecba89,Risza Khoirul,https://play-lh.googleusercontent.com/a/ACg8ocICQPg09MgInGp15Tchxt-zZv69Jpm1e5-k1DnkbjETUBmhPg=mo,"aplikasi cacat pasti klo mau sell di harga tinggi lag, terus pas harga turun baru ke jual. Mending apk sebelah",1,3,2.43.5,,,,2.43.5,4/3/2024,,,,,,
30,b974db99-0064-4495-86fc-3ef157e9dd86,Dhimas Wahyudi,https://play-lh.googleusercontent.com/a-/ALV-UjV7KK5G3PJv3MVottrZw62LPALFrcPvE2ae8lpsSqXlJisra9r9,"Banyak eror,delay ajaib emg ajaib Coin kurang lengkap,fitur kurang,design UI jelek semoga ditingkatkan seperti exchange lainnya kalau gak niat mending gausah bikin app ini sekalian",1,2,2.43.0,,,,2.43.0,4/3/2024,,,,,,
31,caa807e3-99be-4a05-ad32-62489d16d627,Sahabil Ahamad,https://play-lh.googleusercontent.com/a-/ALV-UjXTbXOfCwQ1xgQIaq2Y9ouXiQVvmvzF9pNJEJAcuU4cDUGe6qk,"Apk nya bagus, cuma kekurangan nya gak ada konfersi saldo kecil nya dan domptnya juga gak ada, yang ada dompet cuma BTC, ETH, dan USDT, andai saja apk ini ada dompetnya dan ada konfersi saldo kecilnya, apk yang paling kren daahh🥰🥰🥰",1,0,2.46.0,,,,2.46.0,4/13/2024,,,,,,
32,a485db31-0245-4968-8671-6a6ba5586dfd,chandra Sadeli,https://play-lh.googleusercontent.com/a/ACg8ocIlc1__a0O-cK58pTaPapBFZlyX0icaOtLYB4zT-26ORX_8ww=mo,"Aplikasi exchange paling aneh, harga beli PEPE Rp. 9.000 cuma dapet 71,4 coin tapi dijual cuma dapet Rp. 9. Bukan go to the moon tapi go to uninstall biar gak dikadalin wkwkwk",1,1,2.44.0,,,,2.44.0,3/29/2024,,,,,,
33,f8e7f59a-d82d-4309-bd48-47e9223c9526,Sensational,https://play-lh.googleusercontent.com/a-/ALV-UjXywXGI6Fc0Bb0o_XncfO2gr-KkucBjBeIF7tFBXBzQ8K9Rf9g,Penasaran kalo blom coba sendiri apk nya dan ternyata sesuai rating nya busuk apk nya sampah loh ini masa aplikasi investasi seburuk ini ? Lemot dan gk real time ini harga nya gk cocok buat trading,1,9,2.43.0,,,,2.43.0,2/24/2024,,,,,,
34,80357fef-c738-44e9-abee-8f69212eab5d,Arunika Technologi,https://play-lh.googleusercontent.com/a-/ALV-UjXeT7v4RoVYy-QZu7hglVP7Gg2TpTi183L5vPv8s9dSCsGsZXg,"Kenapa sekarang buat masuk ke akumulasi porto itu agak lama ya, walaupun status di tab transaksi udah match",1,1,2.43.5,,,,2.43.5,10/3/2024,,,,,,
35,8088b51a-56c0-47f4-89bb-bd9d00af01fe,Sultan Bongkar,https://play-lh.googleusercontent.com/a/ACg8ocKhaYbtUGjztji3yRJVstj3xXKhcKNK7vtU7u-TAon1Ayf9=mo,"Aplikasi sampah orang mau ikut depisot ikut tarding ..sudah seharian ..nunggu upgrade masih mnunggu blom trvrivikasi..jauh lbih bgus ,,triv,reku,indodax .. Apk ini apk gk jlas..dah saya unistal",1,0,2.46.5,,,,2.46.5,4/25/2024,,,,,,
36,eeb1544b-1984-4518-bb0d-c52264e6a099,Restu Firmansyah,https://play-lh.googleusercontent.com/a-/ALV-UjUSlF6wBeDpgssmDvwIv8JdgNutXj_QoCJoyMGKk_PZrAHHQpIh,"Masih ngebug ini,saya punya varian aset kripto,tapi pas mau kirim ke wallet lain keterangan saya gapunya aset kripto, aneh 🤣",1,6,2.42.0,,,,2.42.0,2/15/2024,,,,,,
37,b78e37fc-adb5-4cd8-9d29-d8f5731d42f5,Muhammad Shofi'i As'aadi,https://play-lh.googleusercontent.com/a-/ALV-UjVr-odUIOfo2A7E6mmZoI6vhsoYnJ4tzuEdvfLwd1ib85DSbzI2,"Koin vanry gua mana udah gua kirim dari aplikasi pintu lewat e walet polygon matic, gak nyampe ke aplikasi ajaib gimana min, aku dah hubungin admin klen lewat chat tapi sampe skarang blom ada balesan",1,1,2.43.5,,,,2.43.5,3/14/2024,,,,,,
38,23f15ea8-3295-43e6-9401-797fa97e66ae,De' Food's,https://play-lh.googleusercontent.com/a/ACg8ocKSxj90AlpCohPu3ktcOH6vw4RZQtXo48HxJ1PNeBlIGXryXA=mo,"Beamx coin kadang ada limit order nya kadang hanya ada market order saja.., Kenapa bisa begitu ya? Padahal aset kripto lain nya normal² saja tuh.. Kalo tidak ada perbaikan..,mungkin lebih baik trading di aplikasi sebelah aja deh.., Stabil dan fair.. Terimakasih!",1,217,2.39.5,,,,2.39.5,12/17/2023,,,,,,
39,c0b7c8df-c6a5-4098-908b-da95e5faaec3,Haya Pid,https://play-lh.googleusercontent.com/a/ACg8ocJb9XSpigwlTB7ulvSjenby27wSVFXSCpNq6tpwdnWhpEr3TQ=mo,"Sangat lelet,,Buy harga rendah lama, sekali turun mau sell lama juga, ah Cemen aplikasi lemot",1,0,2.46.5,,,,2.46.5,4/23/2024,,,,,,
40,2778669a-325e-4e1f-94e9-758fdaf991a6,Melisa Gb,https://play-lh.googleusercontent.com/a/ACg8ocIZCeBr4MDBD3aIau5Sm9GBl6ONRl4OD3OZgcx0TBSiArB6eg=mo,"Deposit nya cepet giliran withdraw nya lama bener balesannya kaya ga mau bertanggung jawab hadeuh parah si kalo sampe ga dibalikin uang ku, kalo bener dibalikin ku naikin bintang nya 5 skrg 1 dlu sampai uang ku pulang.",1,0,2.46.5,,,,2.46.5,4/23/2024,,,,,,
41,5ce43a6a-d83b-4217-8791-75510ed596cd,Juliantara Putra,https://play-lh.googleusercontent.com/a-/ALV-UjXbzQ6XMyRK32qG4YkRU-vrrK677CpLTvt0eM2BUXEt4FEKgGU,Kebanyakan biaya transfer nya aja sih tolong jangan kebanyakan biaya nya😫🙏🙏🙏,1,0,2.46.0,,,,2.46.0,11/4/2024,,,,,,
42,85ec32aa-7a8c-4540-90b6-32f7ad077c8d,jailani ijai,https://play-lh.googleusercontent.com/a-/ALV-UjXHWrYuzGxF3VhOaAtuTlQr9ks0KQvbi-yOPqgsPwdVPGqV66w,Pengiriman usdt lama sekali Tolong untuk perubahan no.telepon dan akun agar bisa diganti .,1,0,2.46.5,,,,2.46.5,4/30/2024,,,,,,
43,a48983cc-745e-42a7-9fb8-b33444241bd3,johanes tarigan,https://play-lh.googleusercontent.com/a-/ALV-UjUKCjLA40-9gJ3AAQ2A1AlG5T1D28HRMA5ZRv1glc7wsBeCLKE,$ONDO nya bagaimana??? Orang² jual beli $ONDO dan serok cuan. Ini user ajaib cuma bisa nonton!!! $ONDO ada di list tapi gak bisa dibeli. Kalian bodoh atau bagaimana???,1,45,2.46.0,,,,2.46.0,12/4/2024,,,,,,
44,f37dccee-c11d-4893-9d8c-c2939b615310,Bayu Lesmana,https://play-lh.googleusercontent.com/a/ACg8ocL6IvrLbcssoicIj0VkzCPByOULsdv-xrg1Lv9XSkypLByp2w=mo,"Yang kebelet inves mending jangan di apk ini,proses wd nya ribet,udh gitu dana nya ilang gatau ada di mana,di portofolio,inves,ga ada. Untung dana yang hilang ga banyak.buat kalian yang mau invest mending inves emas aj di Reksadana. Kalau urgent lagi btuh bisa langsung di wd ga sampai 5 menit",1,0,2.46.5,,,,2.46.5,4/27/2024,,,,,,
45,ce53ef59-686a-48a6-8774-db17b48c2a47,Robi Darwis,https://play-lh.googleusercontent.com/a/ACg8ocJugQSy7zfIl8N25nmYhTODFlxB1c0zmNXpWK7N3obFk_pvCA=mo,Aplikasi paling buruk wd nya lama bngt live chatnya engga bisa aplikasi scam,1,1,2.46.0,,,,2.46.0,9/4/2024,,,,,,
46,a9af86f8-e18e-41d0-bda5-69045b4bcf05,Malik Ismail-,https://play-lh.googleusercontent.com/a-/ALV-UjVFGAaHz54nUiEHF7ydLCoGq4rz8_SY_THVlbAboGJKyDOBBsSn,"Aplikasi apaan , wd jaringan eth arb ga masuk² , malah ilang 250usd duit gw! Beware yang mau wd di exchange ini!",1,0,2.46.5,,,,2.46.5,4/25/2024,,,,,,
47,213bcf18-e1ba-4084-a219-be943da86906,Muhammad Faisal,https://play-lh.googleusercontent.com/a-/ALV-UjVOcidZ3Y_vnIFw5HjUnsFOQcLyR8tBOlrhDI77CyHN3CVEo9pS,"Aplikasi yang paling lama untuk penarikan dana, setiap tengah malam selalu gangguan, UNINSTALL",1,1,2.44.0,,,,2.44.0,3/29/2024,,,,,,
48,22c081ba-8753-420e-bafc-537a4e19ae9e,kuhaku chanel,https://play-lh.googleusercontent.com/a-/ALV-UjXJYimbm6bXgi2lj-YMyqWk1zrk48SSyB-r4uBBCRC1zfkvIYha,"Baru tadi pagi maintenance siang limit ordernya error harusnya untung 10% malah pas kejual cuma 7%an, mau komplain susah csnya.",1,10,2.45.1,,,,2.45.1,3/31/2024,,,,,,
49,015de8e0-9912-4150-9beb-77fc9d35d9b2,Rizal Brown (r8rown),https://play-lh.googleusercontent.com/a-/ALV-UjXTrxtuwl0LuYeMjwYUdNSwd6k8HCUqPoUR1tu9EXPDzZxdBg,"Baru nyoba app ini eh rupanya saya kecewa Bisa deposit doang tapi gak bisa kirim aset ke wallet lain. Mohon bantuannya dev Trading kena pajak yang bisa dibilang terlalu gede Saran saya buat teman2 download app lain aja, disini repot bro, udah gak lengkap mahal lagi Coba kalau app nya sperti kucoin pasti banyak yang trading disini",1,12,2.41.1,,,,2.41.1,11/2/2024,,,,,,
50,7c81974d-14da-4607-9f3a-21d726d3041f,Abdul Hamid mas,https://play-lh.googleusercontent.com/a-/ALV-UjUuz0OjTUB6tfi_QKKNq4-LDLGxzjktk6vlceMcRNP7jne4KJKg,"Tolong lah buat ajaib buat lebih support investor/trender pemula Kalo bisa fitur StopLose nya bisa diatas harga beli, jika crypto yang dibeli sudah melambung tinggi maka investor/trender masih bisa cuan jika ada guyuran tiba-tiba Dan untuk biaya widraw 9.500 sangat mahal banget bagi pemodal kecil yang cuma ratusan ribu sangat merasa terbebani dan banyak menggerus keuntungan/kerugian kita, saran buat saya biaya WD 2.500-5.000 sudah cukup",1,3,2.41.1,,"Hi kak, terimakasih atas sarannya. Saran kaka kami terima untuk meningkatkan layanan kami kedepannya, jika memiliki kendala silahkan hubungi kami melalui email kami di support.asetkripto@ajaib.co.id. ~ADS",2/9/2023 4:22,2.41.1,4/3/2024,,,,,,
51,ad66cb16-6651-4eb4-94d7-3c057d98db26,L A,https://play-lh.googleusercontent.com/a-/ALV-UjXGuOpgSEQqJrJcI28tU8zN50QQ77-KfcLl2b0lPS3eKkVd4j_F,"Ditulis disitu,bahwa baru bisa deposit jam 2.00 Ini udah 23 menit lewat,ga masuk2,ga muncul2 saldonya,pdahal udah di saldo RDN 😔",1,0,2.43.5,,,,2.43.5,4/20/2024,,,,,,
52,1ea20c65-8ad3-4faa-8f3b-8e2712cb2ee1,teguh sutomo,https://play-lh.googleusercontent.com/a-/ALV-UjUn6UenVI2loAZ7XSUt_eFcNCKNJF7bE8bt8J-_laiYLtNcNUs,"Saldo gua ilang 89.000 habis jual salah satu token padahal ga di tf, udah cancel matchdraw eh malah token ga nambah saldo ilang (tulisannya participally matched)",1,0,2.45.1,,,,2.45.1,8/4/2024,,,,,,
53,b22b7da1-aa26-4ef6-8110-8729ae1acd6c,Dadang Ipey,https://play-lh.googleusercontent.com/a-/ALV-UjWCPwUverKf0WRpdJ9H-iPzzPr5Djc7VUQ_t2lcBF-sCVVac6c,Keterangannya buat akun baru verifikasinya hanya 2 jam kerja tapi sudah lebih 20 hari masih belum acc,1,0,2.45.1,,,,2.45.1,4/4/2024,,,,,,
54,6842dea6-51ea-44fb-9e64-939f8c536a06,Indra Hadist,https://play-lh.googleusercontent.com/a-/ALV-UjUVaB1xe81B8hk2sudcoSiesciGSLnxYqhvpH4rldEy5ZOWPlvN,"Aplikasinya lelet banget, tolong di perbaiki, terkadang juga eror ga bisa di buka",1,1,2.44.0,,,,2.44.0,3/14/2024,,,,,,
55,17075743-2acc-4038-a974-f07469acdd7b,Yoka Rizki,https://play-lh.googleusercontent.com/a-/ALV-UjVUUHbc7J118AVZYRWgjpCUp5pm5_7jvOdoY3hVByZXBEY46iYe,ini kenapa sih kok saya mau daftar ajaib udh kelar tapi verifikasi lama bangett belum diterima dari sana udh dari kemarin tolong dong min gercep dikit kek verifikasinya mau depo padahal,1,1,2.43.5,,,,2.43.5,9/3/2024,,,,,,
56,a4993a27-8956-487b-bde9-183f04630cef,Lingga Januardi,https://play-lh.googleusercontent.com/a-/ALV-UjV7W8uUO0VSQFiGMLnCjR1Rf_5IsHOTMyjzsy-RvAmkJDcSP1hf,Tidak bisa kirim crypto ke dompet lain . Segera diperbaiki . Untuk tim ajaib lebih di update lagi,1,0,2.44.0,,,,2.44.0,3/22/2024,,,,,,
57,8a3b750c-e4a0-4f27-a2aa-3427f9e7f207,Fatchurohman sidiq,https://play-lh.googleusercontent.com/a/ACg8ocKHsieVacBmjuoduJ70KBxd2-fVtwwDETTABudRNQXINvaOCQ=mo,Ini ko saya narik duit ko gabisa masuk ke rekening saya ya??? Padahal status riwayat nya udah berhasil ditarik? Tapi duit di atmnya belum masuk2????,1,1,2.44.0,,,,2.44.0,12/3/2024,,,,,,
58,66bcdde0-0b8d-484c-ab51-d690002e0210,Sultan Sahril,https://play-lh.googleusercontent.com/a/ACg8ocIhcDjaIhnImzOsBlX-gst3O7KkIk_Wfz9Cyf-XIUdZFT6B_Q=mo,"Mengerikan error nya, penjualan direject. Earn yg katanya pendapatan di berikan harian ga ada buktinya. Malah status earn diproses trus, ga ad kejelasan.",1,1,2.43.5,,,,2.43.5,7/3/2024,,,,,,
59,6df723ba-ae49-4917-a7a0-fe219af95556,BANGJA Projects,https://play-lh.googleusercontent.com/a-/ALV-UjWkWtXR7APOCXSNos8zhE3Nq1I7ri0lWKp5B4jHrr9GFg3nvDo,"Gimana sih appnya, saya penarikan udah 2 hari berturut-turut tetep gagal2 terus... Uangnya padahal saya butuh",1,0,2.44.0,,,,2.44.0,3/20/2024,,,,,,
60,a0930d8c-5282-4cea-939e-0983aa101610,Wahyudi Abcd,https://play-lh.googleusercontent.com/a/ACg8ocK4OPKtWfBDVd1ftZbo38834lxkMT8zzdxPX6WBDF3CWnCK3g=mo,"Apk sampah, penarikan tidak masuk, giliran depo 1 menit ganyampe,, udah seminggu dana q belom masuk, padahal di apk nya udah sukses penarikan",1,0,2.44.0,,,,2.44.0,3/31/2024,,,,,,
61,1af5d966-86f3-456f-a9d6-ecb37235fe1a,Sans 07,https://play-lh.googleusercontent.com/a-/ALV-UjU7yi1O-YqEQZbV0OKYrFkFRPt1Z-WhQb6JI3IL-QHvEy-QcgRq,"Minimal WD terlalu besar, fee lumayan nguras dompet juga. Aku main exchange luar aja kalo gitu.",1,0,2.44.0,,,,2.44.0,3/26/2024,,,,,,
62,ab25b7e7-ee88-428c-af50-7e3b69bb5ca8,Rohmat Setyadi,https://play-lh.googleusercontent.com/a-/ALV-UjV6YwErNeHti0oxhCRPtoqLeD53PNv4ZyvCr3X5BMpTwhzf0ZUS,"Porto lagi ijo, market lagi bagus, eehhh aplikasinya dibikin error jadi gabisa jual wkwkw,, ajaib memang",1,1,2.43.5,,,,2.43.5,4/3/2024,,,,,,
